{
  "run_id": "m2",
  "request_id": "m2-validation-r2",
  "agent": "validation",
  "contract_version": "1.0",
  "model": "claude-sonnet-5-5",
  "status": "ok",
  "answer": "가상 고객 시뮬레이션(가정 기반) 결과, GenZ(만 19~29세) 채택 의향은 38.7%로 목표 0.38 이상이고 채택 고객 손익 2.0이 하한 1.5 이상이라 채택 게이트를 넘는다. 다만 체리피커가 채택자의 41.0%이고 손익 0.82로 하한에 못 미치며, 세 시나리오(31.5%, 26.2%, 29.5%)는 목표 아래다. 이 수치는 실제 전환율이 아니다.",
  "result": {
    "twin": {
      "n_personas": 1200,
      "seed": 11,
      "target_adopt": 0.387,
      "all_segments_adopt": {
        "GenZ(만 19~29세)": 0.387,
        "사회초년생(25-29)": 0.473
      },
      "by_type": {
        "일반형": {
          "share_of_adopters": 0.38,
          "profit": 3.13
        },
        "혜택 사냥꾼(체리피커)": {
          "share_of_adopters": 0.41,
          "profit": 0.82
        },
        "충성형": {
          "share_of_adopters": 0.04,
          "profit": 5.32
        },
        "휴면 위험형": {
          "share_of_adopters": 0.17,
          "profit": 1.55
        }
      },
      "adopter_profit": 2.0,
      "static_profit": 3.11,
      "behav_floor": 1.5,
      "scenarios": [
        {
          "name": "기본",
          "adopt": 0.387
        },
        {
          "name": "경쟁사 모방(새로움 50%↓)",
          "adopt": 0.315
        },
        {
          "name": "혜택 20% 축소",
          "adopt": 0.262
        },
        {
          "name": "시장 위축",
          "adopt": 0.295
        }
      ],
      "top_reject": "inertia"
    },
    "voices": [
      {
        "type": "일반형",
        "quote": "배달이랑 외식은 자주 쓰니까 놓친 결제를 앱에서 보고 한 건 골라 돌려받는 건 해볼 만해요. 연회비 1만원에 전월 10만원이면 부담은 크지 않은데, 매달 7일 안에 챙겨야 하는 게 조금 신경 쓰이긴 해요.",
        "would_adopt": true,
        "main_concern": "결제 후 7일 안에 앱에서 직접 지정하지 않으면 환급을 못 받아 매달 챙기는 일이 번거로울 수 있다는 점"
      },
      {
        "type": "체리피커",
        "quote": "외식·배달 1%는 월 한도 5천원에 닿을 만큼만 이 카드로 긁고, 한도가 찬 뒤 결제 중에서 5만원짜리 한 건을 골라 2% 환급을 받으면 되겠네요. 실적 미달 달에도 지정이 된다니 전월 10만원은 크게 신경 안 써도 되고, 나머지 소비는 다른 카드로 돌리면 돼요.",
        "would_adopt": true,
        "main_concern": "지정 건 5만원 상한과 환급 상한 1천원이라 한 번에 받는 금액이 작아 이 카드에 소비를 몰아 줄 만큼은 아니라는 점",
        "exploit_or_risk": "활용·우회 경로: 월 한도 5천원에 닿을 만큼만 외식·배달을 결제하고 한도 소진 후 건 중 1만원 이상 5만원 이하 한 건을 지정해 2%(상한 1천원)를 매달 받은 뒤 나머지 소비는 다른 카드로 돌립니다. 실적 미달 달에도 지정이 허용되므로 전월 이용실적 10만원을 채우지 않고 지정 환급만 받는 사용이 가능하고, 하한 1만원 근처 금액으로 가맹점을 바꿔 가며 지정하는 소액 반복도 남습니다. 막힌 곳: 월 1건 제한, 지정 후 변경 불가, 취소·할부 건과 상품권·선불충전 결제 제외, 본인 명의 외 결제 제외, 같은 가맹점 월 1회 제한입니다. 운영 점검 포인트는 실적 미달 달의 지정 비중, 하한 금액 근처 지정 건 집중, 한도 도달 직후 이용 급감, 1년 내 해지 비율이며, 기본률 1%보다 지정률 2%가 높은 구조와 실적 미달 달 지정 허용은 재무 재판단 항목이다."
      },
      {
        "type": "충성형",
        "quote": "지금 쓰는 카드에 익숙해서 굳이 바꿀 이유는 아직 못 느껴요. 앱에서 혜택 미적용 건 목록과 매달 환급 산정 근거를 보여 준다면 믿고 옮겨서 외식·배달은 이 카드로 몰아 쓸 수는 있을 것 같아요.",
        "would_adopt": false,
        "main_concern": "기존 카드를 정리하고 옮길 만큼 1% 캐시백과 월 1건 지정 환급의 차이가 크게 느껴지지 않는다는 점 (이 역할극은 충성형의 대표 반응이며, 시뮬레이션에서는 충성형 일부가 채택해 채택 고객의 4.0%를 차지한다)"
      },
      {
        "type": "휴면 위험형",
        "quote": "카드는 발급해 두겠지만 평소엔 원래 쓰던 결제수단을 더 쓸 것 같아요. 놓친 건을 7일 안에 앱에 들어가 직접 골라야 한다는 게 귀찮아서 한두 달 하다 말 것 같아요.",
        "would_adopt": false,
        "main_concern": "지정 행동이 번거로워 앱을 열지 않게 되면 환급을 받지 못하고 카드가 서랍에 남을 것 같다는 점"
      }
    ],
    "summary": "가상 고객 시뮬레이션(가정 기반) 결과이며 실제 전환율이 아니다. 가상 고객 1200명(GenZ 600명과 비교용 사회초년생 600명, 시드 11) 중 GenZ(만 19~29세) 채택 의향은 38.7%로 목표 0.38 이상이고, 채택 고객 1인당 손익은 2.0(만원/년)으로 하한 1.5 이상이어서 채택 게이트를 넘는다. 다만 정적 손익 3.11보다 채택 고객 손익이 낮고, 채택자 중 체리피커가 41.0%로 가장 많은데 손익은 0.82로 하한 1.5에 못 미친다. 휴면 위험형은 17.0%이고 손익 1.55로 하한을 간신히 넘으며, 일반형은 38.0%(3.13), 충성형은 4.0%(5.32)다. 역할극의 충성형과 휴면 위험형은 채택하지 않는 쪽의 대표 반응이고, 시뮬레이션에서는 충성형 일부(채택 고객의 4.0%)와 휴면 위험형(17.0%)도 채택했다. 시나리오별 채택 의향은 기본 38.7%에서 경쟁사 모방 31.5%, 혜택 20% 축소 26.2%, 시장 위축 29.5%로 내려가 세 시나리오 모두 목표 0.38에 못 미치고, 혜택 축소 시 가장 낮다. 가장 많은 거절 사유는 지금 쓰는 카드를 바꾸지 않으려는 관성이다. 컨셉에서는 체리피커 손익이 하한 아래인 만큼 소액 반복 지정과 실적 미달 달 지정을 어떻게 막을지 점검할 필요가 있다. 유형별 반응은 역할극이며 통계가 아니다."
  },
  "findings": [
    {
      "id": "validation#0",
      "claim": "가상 고객 1200명 기준 GenZ(만 19~29세) 채택 의향은 38.7%로 목표 0.38 이상이다.",
      "type": "estimate",
      "source_id": null,
      "confidence": "medium"
    },
    {
      "id": "validation#1",
      "claim": "채택 고객 1인당 손익은 2.0(만원/년)으로 정적 손익 3.11보다 낮고 하한 1.5 이상이다.",
      "type": "estimate",
      "source_id": null,
      "confidence": "medium"
    },
    {
      "id": "validation#2",
      "claim": "채택자 중 체리피커는 41.0%이고 손익 0.82로 하한 1.5에 못 미치며, 휴면 위험형은 17.0%이고 손익 1.55다.",
      "type": "estimate",
      "source_id": null,
      "confidence": "medium"
    },
    {
      "id": "validation#3",
      "claim": "혜택 20% 축소 시나리오의 채택 의향은 26.2%로 네 시나리오 중 가장 낮고, 기본 외 세 시나리오 모두 목표 0.38에 못 미친다.",
      "type": "estimate",
      "source_id": null,
      "confidence": "medium"
    },
    {
      "id": "validation#4",
      "claim": "최다 거절 사유는 inertia(기존 카드 관성)다.",
      "type": "estimate",
      "source_id": null,
      "confidence": "medium"
    },
    {
      "id": "validation#5",
      "claim": "체리피커 역할극에서는 월 한도까지만 쓰고 한도 소진 후 한 건을 지정하는 이용과, 실적 미달 달 지정을 이용한 소액 반복 지정이 남는다고 보았다. 역할극이며 통계가 아니다.",
      "type": "background",
      "source_id": null,
      "confidence": "low"
    }
  ],
  "sources": [],
  "assumptions": [
    "세그먼트별 가상 고객 1200명의 효용 모형과 PM 가정치를 사용한다.",
    "시나리오 4종은 코드 시뮬레이션(시드 11)의 결과다.",
    "목표 채택 의향 0.38은 PM 가정치다."
  ],
  "unresolved": [
    "실제 전환율은 확인 불가(가상 고객 모형은 가정 기반이며 내부 데이터 확인 필요).",
    "사후 지정 행동의 번거로움이 사용률에 미치는 영향은 모형 입력에서 확인되지 않았다.",
    "체리피커 비중 41.0%와 손익 0.82가 소액 반복 지정 방어(지정 건 하한 1만원)로 얼마나 개선되는지는 재시뮬레이션이 필요하다."
  ],
  "limits": [
    "채택 의향 38.7%를 전환율로 읽지 않는다.",
    "유형별 반응은 역할극이며 통계가 아니다.",
    "가상 고객 1,200명은 GenZ 600명과 비교용 사회초년생 600명으로 나눈 것이며, 채택 의향 38.7%는 GenZ 600명 기준이다.",
    "기존 카드를 이미 가진 고객이 이 카드를 어떻게 쓰는지, 지정 환급 이후의 이용 변화는 모형에 넣지 않았다."
  ],
  "clarifications": [],
  "out_of_scope": {
    "detected": false,
    "suggested_agent": null
  },
  "followups": [
    "체리피커 손익을 하한 위로 올리려면 지정 건 조건을 어떻게 바꿔야 해?",
    "혜택 20% 축소 시나리오에서 채택 의향이 가장 크게 떨어지는 이유를 보여줘",
    "이 카드를 가드레일 점검으로 다시 넘겨줘"
  ],
  "input_refs": [
    "07-validation/in.json",
    "07-validation/twin.json"
  ]
}
