{
  "run_id": "v2rec",
  "request_id": "v2rec-guardrail-r1",
  "agent": "guardrail",
  "contract_version": "1.0",
  "model": "claude-sonnet-5-5",
  "status": "ok",
  "answer": "G1, G2, G6은 fix, G3(준법)과 G4(개인정보)는 needs_human, G5는 pass로 판정했다. 핵심은 졸업 후 실적 없음으로 읽히는 문구와 졸업 후 유지되는 월 한도 4천원 및 연체 시 복귀 규칙의 불일치, 졸업 해제 조건과 혜택 수준의 변경 가능 여부, 월 1건 소액 이용으로 졸업하는 체리피킹(체리피커 채택자의 0.38, 손익 -0.45)이다. 채택 의향과 손익은 가상 고객 시뮬레이션 결과이며 법률 판단을 대체하지 않는다.",
  "result": {
    "checks": [
      {
        "id": "G1",
        "item": "이름·한 줄 약속과 실제 작동 방식 일치(과장·불일치)",
        "status": "fix",
        "finding": "이름 '실적 졸업'과 one_liner의 '연체 없이 졸업하면 실적 조건 없이'는 졸업 후 실적 부담이 영구히 사라지는 것으로 읽힐 소지가 있다. mechanics는 다르게 정한다. 졸업 조건은 12개월 연체 0회에 더해 9개월 이상 월 1건 이상 이용이며(one_liner에는 월 1건 조건이 없다), 졸업 후 연체가 생기면 연습 구간으로 돌아가고, 졸업 후에도 영역별 월 한도 4천원과 연회비 1만원은 그대로다. hook의 '한 번 해제'도 복귀 규칙을 가린다. 또 one_liner는 '첫 신용카드'라고 쓰지만 mechanics의 대상은 일반 기준을 통과한 만 19세 이상 본인 회원이어서, 첫 카드 여부를 확인하는 장치는 입력에 없다. 이름과 약속이 작동 방식보다 강하게 읽혀 fix로 판정한다.",
        "suggestion": "one_liner를 다음 취지로 고친다. '발급 후 12개월은 전월 15만원 이상이면 외식·배달 1%, 편의점·마트 1.5% 할인(영역별 월 한도 4천원), 미달 월에는 국내 가맹점 0.5% 적립. 12개월 연체 0회에 9개월 이상 월 1건 이상 이용하면 13개월 차부터 전월실적 조건이 해제되며, 졸업 후 연체가 생기면 연습 구간으로 돌아간다.' '첫 신용카드'는 대상 확인 장치가 없으면 빼고 '카드 이용이 처음인 고객을 주 대상으로 한다' 정도로 낮춘다. hook의 '한 번 해제'는 '조건을 지키는 동안 해제'로 바꾸고 '영구', '평생', '실적 걱정 끝' 같은 표현은 쓰지 않는다.",
        "owner_dept": "상품"
      },
      {
        "id": "G2",
        "item": "광고 표현 위험(단정·과장·오인 소지, 합산 혜택 오인)",
        "status": "fix",
        "finding": "오인 소지가 큰 지점은 네 가지다. (a) '졸업', '실적 조건 없이'가 단독으로 쓰이면 졸업 후 실적도 한도도 없는 카드로 읽힐 수 있다. 실제로는 영역별 월 한도 4천원이 유지되고 연체 시 연습 구간으로 돌아간다. (b) 입력의 risks와 hypotheses가 이미 지적한 대로 '처음 1년만 실적이 있는 카드'로 읽히거나, 반대로 12개월 이후 실적이 아예 필요 없는 카드로 읽히는 두 방향의 오인이 모두 가능하다. (c) 미달 월 0.5% 적립은 연습 구간 12개월에만 해당하는 조건이며, 졸업 후 실적 조건이 해제된 뒤의 적립과 혼동되지 않게 구분해야 한다. 1% 또는 1.5% 할인과 0.5% 적립을 합산한 비율 표현도 오인을 낳는다. (d) 경쟁 DB 50종 중 실적 졸업 0종이라는 비교는 국내 전 카드를 조사한 결과가 아니므로 '최초', '유일'로 옮기면 안 된다.",
        "suggestion": "1) '졸업'이 나오는 모든 지면에 '12개월 연체 0회와 9개월 이상 월 1건 이상 이용 시, 영역별 월 한도 4천원 유지, 졸업 후 연체 시 연습 구간 복귀'를 같은 크기 수준으로 병기한다. 2) '실적 걱정 없는', '실적 영구 면제' 같은 표현을 쓰지 않고 '13개월 차부터 전월실적 조건 해제(조건 충족 시)'로 쓴다. 3) 첫 12개월에 실적 조건이 있다는 점을 숨기지 않고 '첫 12개월은 전월 15만원 이상 시 할인, 미달 월은 국내 가맹점 0.5% 적립'을 함께 쓴다. 4) 할인율과 적립률을 더한 합산 비율과 '혜택 0 방지'를 상시 혜택처럼 읽히게 하는 문구를 쓰지 않는다. 5) 경쟁 비교는 '최초', '유일' 없이 '처음부터 실적 조건이 없는 카드나 매달 구간을 판정하는 카드와 달리 보유 이력으로 조건이 해제되는 구조'로 쓴다. 6) 집행 전 카피는 광고심의 검토를 거친다.",
        "owner_dept": "광고심의"
      },
      {
        "id": "G3",
        "item": "부가서비스 변경 제한·혜택 지급 조건 고지",
        "status": "needs_human",
        "finding": "이 카드의 핵심 혜택은 시간이 지나 실적 조건이 해제되는 구조라서, 졸업 해제 조건(12개월 연체 0회, 9개월 이상 월 1건 이상 이용)과 졸업 후 혜택 수준(외식·배달 1%, 편의점·마트 1.5%, 영역별 월 한도 4천원)을 나중에 바꿀 수 있는지가 쟁점이다. 졸업을 앞둔 회원이 있는 상태에서 졸업 조건을 강화하거나 한도를 낮추면 이미 연습 구간을 지난 회원의 기대와 충돌할 수 있다. 상품설명서에 졸업 규칙과 변경 방식이 적히는 것은 mechanics에 있으나, 이 규칙을 부가서비스로 보고 유지 의무와 변경 제한의 대상으로 묶을지, 약관 신고 대상인지는 card.risks에 사람 확인 필요로 적혀 있고 현행 규정 원문은 근거 팩에 없어 조문을 특정하지 않는다. 입력에 없어 정해져야 할 조건도 있다. 졸업 판정 시점(12개월째 말일인지), 월 1건 이용의 인정 거래(취소·할부·정기결제 포함 여부), 연체의 정의와 기준일, 졸업 후 복귀 시 다시 졸업하는 조건, 졸업 예정 3개월 전 앱 알림의 방식이다. 확인 질문: 졸업 해제 조건과 졸업 후 혜택 수준을 부가서비스로 보고 상품설명서에 둘 경우, 이미 졸업한 회원과 졸업 예정 회원에게 불리한 변경이 가능한 시점과 사전 고지 기간을 어떻게 정해야 하는가?",
        "suggestion": "상품 설계 전에 상품팀이 졸업 판정 시점, 월 1건 인정 거래, 연체 정의, 복귀 후 재졸업 조건을 정해 준법에 넘긴다. 졸업 조건과 혜택 수준은 가입 전 상품설명서와 가입 화면에 적고, 변경이 필요한 경우의 사전 고지 방법은 준법 확인 결과에 맞춘다.",
        "owner_dept": "준법"
      },
      {
        "id": "G4",
        "item": "그룹사(증권·보험·은행) 연계 시 개인정보 결합·제3자 제공 동의",
        "status": "needs_human",
        "finding": "links가 비어 있어 증권·보험·은행 그룹사 연계와 그에 따른 결합·제3자 제공은 입력상 없고, card.risks도 자사 결제·납부 이력만 쓰고 외부 정보는 쓰지 않는다고 적는다. 다만 졸업 판정은 12개월 동안의 연체 이력과 월별 이용 건수를 개인별로 계속 집계해 혜택 조건을 해제하거나 복귀시키는 처리이며, 졸업 후에도 연체가 생기면 상태를 되돌리므로 이용 이력이 판정에 반복해서 쓰인다. 이 처리가 카드 이용계약 이행 범위에 드는지, 별도 동의가 필요한지는 근거 팩에 기준이 없어 단정하지 않는다. 확인 질문: 졸업 판정에 쓰는 연체 이력과 월별 이용 건수 집계가 이용계약 이행 범위에 들어가는지, 졸업 상태와 복귀 여부를 앱에 표시하고 졸업 예정 알림을 보내는 데 별도 고지나 동의가 필요한지?",
        "suggestion": "그룹사 연계를 추가하지 않는 현재 설계를 유지한다. 개인정보 담당 확인 결과에 맞춰, 가입 화면에 판정에 쓰는 정보 항목(결제대금 연체 여부, 월별 이용 건수), 이용 기간(발급 후 12개월과 졸업 후 복귀 판정), 이용 목적을 적는다. 졸업 판정에 외부 신용정보를 쓰지 않는다는 점을 설계 기준으로 유지한다.",
        "owner_dept": "개인정보"
      },
      {
        "id": "G5",
        "item": "투자 연계 상품의 투자권유·원금 손실 오인",
        "status": "pass",
        "finding": "links가 비어 있고 tags(perf_graduation, zero_floor, anti_cap, reward_discount)에 투자 관련 태그가 없다. 혜택은 외식·배달·편의점·마트 할인과 국내 가맹점 적립이며, 대화 맥락의 범위 확인에서도 투자 연계 제외로 정해졌다. 투자권유나 원금 손실 오인 쟁점은 찾지 못했다. 미달 월 0.5% 적립 문구에서 '쌓인다', '불어난다' 같은 수익 암시 표현을 쓰지 않으면 이 상태를 유지할 수 있다."
      },
      {
        "id": "G6",
        "item": "체리피킹·역선택 대비(채택 고객 유형별 손익 참고)",
        "status": "fix",
        "finding": "precheck 플래그가 걸려 있어 pass로 둘 수 없다. 혜택 사냥꾼(체리피커)은 채택자의 0.38이고 손익은 -0.45로 3 미만이며 유일하게 음수다. 휴면 위험형은 채택자의 0.18에 손익 1.66이다. 채택 고객 손익은 1.69로 정적 손익 3.11보다 낮다. 졸업 구조의 체리피킹 경로는 두 가지다. 첫째, 졸업의 금액 조건이 없고 월 1건 이상 이용만 9개월 채우면 되므로, 소액 결제로 최소 이용 패턴을 만들어 13개월 차에 실적 조건을 해제하는 경로가 열려 있다. mechanics도 월 1건 조건은 행동 조건 역할이 작아 실질 조건이 연체 0회라고 인정한다. 둘째, 졸업 후에는 지급 필터인 실적 조건이 사라지고 영역별 월 한도 4천원만 비용을 막으므로, 한도만 받고 해지하는 행동이 가능하다. card.risks는 이 행동을 내부 데이터 확인 필요로 적었다. 방어 장치(졸업 후 연체 시 복귀, 한도와 연회비 1만원 유지)는 있으나, 연체 시 복귀는 연체를 하지 않는 체리피커를 막지 못한다. 미달 월 0.5% 적립은 시뮬레이션에 넣지 않았다고 rationale에 적혀 있어 이 수치는 그 비용을 반영하지 않는다(추정). 혜택 20% 축소 시나리오에서 채택 의향은 0.438에서 0.288로 낮아지므로, 혜택을 줄이는 방어는 채택 감소와 함께 봐야 한다. 수치는 가상 고객 시뮬레이션 결과이며 실제 전환율이나 실제 손익과 다를 수 있다.",
        "suggestion": "1) 졸업 조건의 이용 요건을 최소 이용 금액이 있는 형태로 조정하는 안을 상품팀이 검토한다. 예를 들어 월 1건 대신 입력의 minPerf 15만원보다 낮은 별도 금액 기준을 두는 안이며, 금액은 재무가 원가 검증으로 정한다. 2) 졸업 후 혜택 지급 필터로 영역별 월 한도 4천원과 연회비 1만원을 유지할지, 한도를 낮추거나 졸업 후 일정 기간 해지 시 혜택을 환수할지 재무가 정한다(환수는 준법 확인 필요). 3) 미달 월 0.5% 적립의 비용을 시뮬레이션에 넣어 체리피커 손익 -0.45가 어떻게 바뀌는지 다시 돌린다. 4) 출시 후 점검 지표로 졸업 직후 3개월 이내 해지 비율, 월 1건 이용만 하는 계좌 비중, 영역별 한도 도달 직후 이용 급감을 둔다. 5) 마케팅은 혜택 비교 커뮤니티를 겨냥한 '조건 맞추면 졸업' 식 메시지를 피하고 주 카드 사용을 전제로 쓴다.",
        "owner_dept": "재무"
      }
    ],
    "name_mechanism_consistent": false,
    "overall": "고칠 것은 G1(one_liner와 hook에 월 1건 이용 조건, 한도 유지, 연체 시 복귀를 병기), G2(졸업 후 실적 없음과 첫 1년만 실적이 있다는 두 방향 오인 방지 문구), G6(월 1건 소액 이용으로 졸업하는 경로와 졸업 후 한도만 받고 해지하는 경로 대비)다. 확인받을 것은 졸업 해제 조건과 혜택 수준의 변경 가능 여부를 부가서비스 유지 의무와 연결해 보는 준법 확인(G3)과 졸업 판정에 쓰는 이용 이력의 처리 범위를 보는 개인정보 확인(G4)이다. 문구 수정과 설계값 결정을 거치면 법무 이관 전 단계로 진행할 수 있다.",
    "required_disclosures": [
      "발급 후 12개월 동안 전월 이용실적 15만원 이상이면 외식·배달 1%, 편의점·마트 1.5% 할인을 받으며, 영역별 월 한도는 4천원입니다.",
      "전월 이용실적 15만원 미만인 달에는 할인이 적용되지 않고 국내 가맹점 0.5% 적립이 적용됩니다(연습 구간 12개월 한정).",
      "13개월 차부터 전월실적 조건이 해제되려면 12개월 결제대금 연체 0회와 9개월 이상 월 1건 이상 이용을 모두 충족해야 하며, 졸업 후에도 영역별 월 한도 4천원은 그대로입니다.",
      "졸업 후 결제대금 연체가 생기면 연습 구간으로 돌아가 전월 이용실적 조건이 다시 적용됩니다.",
      "졸업 판정 기준, 판정 시점, 혜택 한도는 약관과 상품설명서에 기재되며, 졸업 예정 3개월 전부터 앱에서 남은 조건을 안내합니다.",
      "할인받은 금액과 정기결제는 전월 이용실적에서 제외하지 않으며 앱에서 실적 진행률을 확인할 수 있습니다.",
      "연회비는 국내전용 1만원입니다.",
      "부가서비스(졸업 조건, 할인율, 한도)는 변경될 수 있으며, 변경 시 사전에 고지합니다(변경 가능 범위와 고지 기간은 준법 확인 후 기재).",
      "졸업 판정을 위해 회원의 결제대금 연체 이력과 월별 카드 이용 건수를 활용합니다."
    ]
  },
  "findings": [
    {
      "id": "guardrail#0",
      "claim": "G1 fix: 이름과 one_liner의 졸업 후 실적 조건 없음 표현이 월 1건 이용 조건, 월 한도 4천원 유지, 연체 시 연습 구간 복귀보다 강하게 읽힌다.",
      "type": "estimate",
      "source_id": null,
      "confidence": "medium"
    },
    {
      "id": "guardrail#1",
      "claim": "G2 fix: 졸업 후 실적 없음과 첫 1년에만 실적이 있다는 두 방향의 오인, 0.5% 적립과 할인 합산 오인, 경쟁 비교의 최초 단정 전환 위험이 있다.",
      "type": "estimate",
      "source_id": null,
      "confidence": "medium"
    },
    {
      "id": "guardrail#2",
      "claim": "G3 needs_human(준법): 졸업 해제 조건과 졸업 후 혜택 수준을 부가서비스 유지 의무와 변경 제한 대상으로 볼지는 근거 팩에 조문이 없어 사람 확인이 필요하다.",
      "type": "estimate",
      "source_id": null,
      "confidence": "medium"
    },
    {
      "id": "guardrail#3",
      "claim": "G4 needs_human(개인정보): 그룹사 연계는 없으나 졸업 판정에 연체 이력과 월별 이용 건수를 반복 사용하는 처리의 동의 범위는 사람 확인이 필요하다.",
      "type": "estimate",
      "source_id": null,
      "confidence": "medium"
    },
    {
      "id": "guardrail#4",
      "claim": "G5 pass: 투자 연계가 없고 혜택은 할인과 적립뿐이라 투자권유와 원금 손실 오인 쟁점을 찾지 못했다.",
      "type": "estimate",
      "source_id": null,
      "confidence": "medium"
    },
    {
      "id": "guardrail#5",
      "claim": "G6 fix: 체리피커 채택자의 0.38에 손익 -0.45로 플래그가 걸렸고, 금액 조건 없는 월 1건 이용으로 졸업하는 경로와 졸업 후 한도만 받고 해지하는 경로를 막는 설계값을 재무와 상품이 정해야 한다.",
      "type": "estimate",
      "source_id": null,
      "confidence": "medium"
    }
  ],
  "sources": [],
  "assumptions": [
    "수치는 입력의 card, metrics, twin 값만 인용했다.",
    "근거 팩에 법령 조문이 없어 부가서비스 유지 의무, 약관 신고, 개인정보 동의 요건은 조문을 특정하지 않고 needs_human으로 두었다.",
    "광고 심의 기준 원문이 없어 자체 점검 목록으로 보았다."
  ],
  "unresolved": [
    "졸업 판정 시점, 월 1건 인정 거래, 연체 정의, 복귀 후 재졸업 조건은 입력에 없어 상품팀 확인 필요.",
    "졸업 후 한도만 받고 해지하는 행동의 규모는 내부 데이터 확인 필요.",
    "졸업 해제 조건과 혜택 수준의 변경 가능 여부는 현행 규정 원문 미확인으로 준법 확인 필요."
  ],
  "limits": [
    "법률 판단을 대체하지 않으며 needs_human 항목은 담당 부서 확인이 필요하다.",
    "채택 의향과 유형별 손익은 가상 고객 시뮬레이션 결과이며 실제 전환율이 아니다.",
    "미달 월 0.5% 적립은 시뮬레이션에 넣지 않았다.",
    "광고 심의 기준 원문이 없다."
  ],
  "clarifications": [],
  "out_of_scope": {
    "detected": false,
    "suggested_agent": null
  },
  "followups": [
    "G1, G2 수정안을 반영해 컨셉 문구를 고쳐줘",
    "졸업 조건의 최소 이용 금액안을 손익과 함께 비교해줘",
    "준법과 개인정보에 넘길 확인 질문 목록으로 정리해줘"
  ],
  "input_refs": [
    "08-guardrail/in.json"
  ]
}