{
  "run_id": "v2rec",
  "request_id": "v2rec-guardrail-r2",
  "agent": "guardrail",
  "contract_version": "1.0",
  "model": "claude-sonnet-5-5",
  "status": "ok",
  "answer": "1차 지적 중 G1, G2는 card 문구가 고쳐져 pass로 바뀌었고, G3(준법)과 G4(개인정보)는 사람 확인이 계속 필요하며 G6만 fix로 남았다. G6은 졸업 이용 조건의 금액이 입력에 없고 환수가 미정이며 체리피커 채택자 0.38, 손익 -0.45가 이번 방어를 반영하지 않아 해소되지 않았다. 컨셉 재작업 상한 1회가 소진되어 남은 fix는 디자인·마케팅 문구와 기획서 리스크로 이월되며, 채택 의향과 손익은 가상 고객 시뮬레이션 결과로 실제 전환율이 아니다.",
  "result": {
    "checks": [
      {
        "id": "G1",
        "item": "이름·한 줄 약속과 실제 작동 방식 일치(과장·불일치)",
        "status": "pass",
        "finding": "1차 지적은 해소됐다. one_liner가 연습 구간 조건(전월 15만원 이상 시 외식·배달 1%, 편의점·마트 1.5% 할인, 영역별 월 한도 4천원), 미달 월 0.5% 적립, 졸업 조건(12개월 연체 0회, 9개월 이상 월 이용 금액 기준), 졸업 후 영역별 월 한도 유지, 졸업 후 연체 시 연습 구간 복귀를 모두 담는다. '첫 신용카드'는 '카드 이용이 처음인 고객을 주 대상'으로 낮췄고 cvp.target도 첫 카드 확인 장치가 없음을 적는다. hook은 '한 번 해제'가 '조건을 지키는 동안 해제'로 바뀌어 복귀 규칙과 맞는다. 이름의 '졸업'은 남아 있으나 약속 문장이 mechanics보다 강하게 읽히지 않아 pass로 본다. 단, 졸업 이용 조건의 금액이 입력에 없어(재무가 원가 검증으로 정함) 이 판단은 금액이 정해진 뒤 약속 문장과 다시 대조한다는 조건이 붙는다. 금액 미정에 따른 고지와 방어 쟁점은 G3와 G6에서 다룬다."
      },
      {
        "id": "G2",
        "item": "광고 표현 위험(단정·과장·오인 소지, 합산 혜택 오인)",
        "status": "pass",
        "finding": "1차 지적은 카드 문구 수준에서 해소됐다. one_liner와 cvp.key_benefit는 할인(1%, 1.5%)과 적립(0.5%)을 별개 조건으로 나눠 쓰고 합산 비율을 쓰지 않으며, 0.5% 적립은 연습 구간에만 해당한다고 적었다. risks에 '영구', '평생', '실적 걱정 끝', '최초', '유일'과 합산 비율 금지, '졸업' 안내마다 조건 병기, 집행 전 광고심의 검토가 명시됐다. 경쟁 비교(differentiator, why_unusual)는 경쟁 DB 50종 기준이며 국내 전 카드를 조사한 결과가 아님을 밝혀 최초·유일 단정으로 읽히지 않는다. 남은 오인 소지는 두 가지로 이월한다. 첫째, '졸업'이나 '실적 조건 해제'가 병기 없이 단독으로 쓰이면 '처음 1년만 실적이 있는 카드'로 읽힐 수 있다는 점은 card.hypotheses에서 검증 대상으로 남아 있다. 둘째, 병기 문구는 아직 규칙일 뿐 실제 카피가 아니고, 졸업 이용 조건의 금액이 비어 있어 병기 문구를 완성할 수 없다. 두 가지는 design_marketing 단계에서 실제 카피로 광고심의 검토를 받는 조건으로 둔다."
      },
      {
        "id": "G3",
        "item": "부가서비스 변경 제한·혜택 지급 조건 고지",
        "status": "needs_human",
        "finding": "카드는 졸업 판정 기준, 시점, 한도를 약관과 상품설명서에 적고 졸업 예정 3개월 전부터 앱에서 남은 조건을 알리며 졸업 후 연체 시 복귀 규칙도 미리 적는다고 정해, 고지 구조 자체는 1차보다 구체적이다. 해소되지 않은 것은 세 가지다. (a) 졸업 규칙과 부가서비스 유지 의무의 관계, 졸업 상태 변경의 약관 신고 대상 여부는 card.risks가 사람 확인 필요로 남겼고 근거 팩에 현행 규정 원문이 없어 조문을 특정하지 않는다. (b) 졸업 이용 조건의 금액이 입력에 없어, 가입 전에 고지해야 할 핵심 조건 하나가 비어 있다. 이 금액은 입력에 없으므로 이 점검에서 정하지 않는다. (c) 졸업 후 일정 기간 내 해지 시 혜택 환수는 재무와 준법이 정한다고만 되어 있어 환수 조건이 고지 대상이 될지 정해지지 않았다. 확인 질문: 졸업 해제 조건과 졸업 후 혜택 수준을 부가서비스로 볼 경우, 이미 졸업한 회원과 졸업 예정 회원에게 불리한 변경이 가능한 시점과 사전 고지 기간은 어떻게 정해야 하는가? 졸업 이용 조건의 금액과 환수 조건이 정해지지 않은 상태에서 상품설명서와 가입 화면에 어떤 문구로 먼저 고지할 수 있는가?",
        "suggestion": "재무가 졸업 이용 조건의 금액을 정해 상품팀에 전달한 뒤 가입 화면, 상품설명서, 약관에 같은 숫자로 적는다. 환수를 두는 경우 환수 조건도 가입 전 고지 항목에 넣는다. 부가서비스 유지 의무와 변경 시 사전 고지 방법은 준법 확인 결과에 맞춘다.",
        "owner_dept": "준법"
      },
      {
        "id": "G4",
        "item": "그룹사(증권·보험·은행) 연계 시 개인정보 결합·제3자 제공 동의",
        "status": "needs_human",
        "finding": "links가 비어 있어 그룹사 연계에 따른 결합·제3자 제공은 입력상 없고, card.risks는 자사 결제·납부 이력만 쓰고 외부 정보는 쓰지 않는다고 적는다. 1차에서 개인정보 담당 확인으로 올린 쟁점, 즉 졸업 판정에 연체 이력과 월 이용 금액을 반복 집계하는 처리의 고지·동의 범위는 이번 card에서도 별도 설계가 추가되지 않았다. 졸업 예정 3개월 전 앱 알림과 졸업·복귀 상태 표시도 같은 처리에 포함된다. 근거 팩에 기준이 없어 단정하지 않으므로 needs_human을 유지한다. 확인 질문: 졸업 판정에 쓰는 연체 이력과 월 이용 금액 집계가 카드 이용계약 이행 범위에 드는가, 졸업 상태 표시와 졸업 예정 알림에 별도 고지나 동의가 필요한가?",
        "suggestion": "그룹사 연계를 추가하지 않는 현재 설계를 유지하고 졸업 판정에 외부 신용정보를 쓰지 않는다는 기준을 지킨다. 개인정보 담당 확인 결과에 맞춰 가입 화면에 판정에 쓰는 정보 항목, 이용 기간, 이용 목적을 적는다.",
        "owner_dept": "개인정보"
      },
      {
        "id": "G5",
        "item": "투자 연계 상품의 투자권유·원금 손실 오인",
        "status": "pass",
        "finding": "links가 비어 있고 tags(perf_graduation, zero_floor, anti_cap, reward_discount)에 투자 관련 태그가 없으며, 혜택은 외식·배달·편의점·마트 할인과 국내 가맹점 적립이다. 대화 맥락에서도 투자 연계 제외로 범위가 정해졌다. 투자권유나 원금 손실 오인 쟁점을 찾지 못했다. 적립 문구에 수익을 암시하는 표현을 쓰지 않으면 이 상태를 유지한다."
      },
      {
        "id": "G6",
        "item": "체리피킹·역선택 대비(채택 고객 유형별 손익 참고)",
        "status": "fix",
        "finding": "precheck 플래그가 그대로 걸려 있어 pass로 둘 수 없다. 체리피커는 채택자의 0.38이고 손익은 -0.45로 3 미만이며 유일하게 음수다. 일반형도 0.38에 손익 3.34, 휴면 위험형은 0.18에 손익 1.66, 채택 고객 손익은 1.69로 정적 손익 3.11보다 낮다. 1차 지적 중 반영된 부분이 있다. 졸업 이용 조건을 월 1건에서 월 이용 금액 기준으로 바꿨고, 졸업 후 한도만 받고 해지하는 행동에 대한 해지 시 환수 검토, 출시 후 점검 지표 3종이 risks와 mechanics에 들어갔다. 그러나 방어가 설계값으로 닫히지 않았다. (a) 방어의 핵심인 졸업 이용 조건의 금액이 입력에 없다. 금액이 없으므로 '소액 결제 1건으로는 졸업 이용 조건을 채울 수 없다'는 mechanics의 문장도 지금은 근거 없이 단정하는 표현이다. (b) 환수 여부와 조건이 미정이다. (c) 연체 시 복귀 규칙은 연체하지 않는 체리피커를 막지 못한다. (d) 이번 card의 체리피커 손익 -0.45는 금액 기준 변경과 미달 월 0.5% 적립 비용을 반영하지 않은 값이라 방어 효과도 비용도 이 수치로 확인되지 않는다(rationale에 0.5% 적립은 시뮬레이션에 넣지 않았다고 적혀 있다). (e) 혜택 20% 축소 시 채택 의향이 0.438에서 0.288로 낮아져 한도·혜택 축소로 막는 길은 card가 이미 택하지 않았다. 따라서 금액 기준을 숫자로 채우기 전에는 체리피킹 대비가 충분하다고 판단할 수 없다. 수치는 가상 고객 시뮬레이션 결과이며 실제 전환율이나 실제 손익과 다를 수 있다.",
        "suggestion": "1) 재무가 원가 검증으로 졸업 이용 조건의 금액을 정하고, 정해진 값은 card 설계값과 카피에 숫자로 반영한다(이 점검에서는 금액을 제시하지 않는다). 금액이 정해지기 전에는 mechanics의 '소액 결제 1건으로는 채울 수 없다'를 '금액 기준으로 소액 1건 졸업을 막는 것을 설계 목표로 한다'로 낮춰 쓴다. 2) 졸업 후 일정 기간 내 해지 시 환수 여부와 기간을 재무와 준법이 정해 G3 고지 항목에 넣는다. 3) 금액 기준과 미달 월 0.5% 적립 비용을 넣어 시뮬레이션을 다시 돌려 체리피커 손익 -0.45가 어떻게 바뀌는지 기획서에 싣는다. 4) 출시 후 점검 지표(졸업 직후 3개월 이내 해지 비율, 졸업 기준 금액 근처만 쓰는 계좌 비중, 영역별 한도 도달 직후 이용 급감)를 기획서 리스크 항목에 유지한다. 5) 마케팅 카피는 혜택 비교 커뮤니티를 겨냥한 '조건 맞추면 졸업' 식 메시지를 피하고 주 카드 사용을 전제로 쓴다.",
        "owner_dept": "재무"
      }
    ],
    "name_mechanism_consistent": true,
    "overall": "1차 fix였던 G1과 G2는 one_liner, hook, 병기 문구 규칙, 합산 비율 금지가 반영되어 pass로 바뀌었고, G6은 졸업 이용 조건의 금액 미정, 환수 미정, 시뮬레이션 미반영(체리피커 채택자 0.38, 손익 -0.45)으로 fix가 남았다. 확인받을 것은 졸업 규칙과 부가서비스 유지 의무의 관계, 금액·환수 조건의 고지 방식(G3, 준법)과 졸업 판정용 이력 처리의 고지·동의 범위(G4, 개인정보)다. 컨셉 재작업 상한(1회)이 소진되어 G6 fix는 재작업 없이 디자인·마케팅 문구(금액 병기, 비교 커뮤니티 메시지 회피)와 기획서 리스크(금액 결정, 환수, 재시뮬레이션, 점검 지표)로 이월하며, 금액이 정해지기 전에는 광고 카피를 집행 단계로 넘기지 않는 조건으로 법무 이관 전 단계 진행이 가능하다.",
    "required_disclosures": [
      "발급 후 12개월 동안 전월 이용실적 15만원 이상이면 외식·배달 1%, 편의점·마트 1.5% 할인을 받으며, 영역별 월 한도는 4천원입니다.",
      "전월 이용실적 15만원 미만인 달에는 할인이 적용되지 않고 국내 가맹점 0.5% 적립이 적용됩니다(발급 후 12개월 연습 구간에만 해당).",
      "13개월 차부터 전월실적 조건이 해제되려면 12개월 결제대금 연체 0회와 9개월 이상 월 이용 금액 기준([금액: 재무 결정 후 기재])을 모두 충족해야 하며, 해제된 뒤에도 영역별 월 한도 4천원과 연회비 1만원은 그대로입니다.",
      "졸업 후 결제대금 연체가 생기면 연습 구간으로 돌아가 전월 이용실적 조건이 다시 적용됩니다.",
      "졸업 판정 기준, 시점, 한도는 약관과 상품설명서에 기재되며, 졸업 예정 3개월 전부터 앱에서 남은 조건을 안내합니다.",
      "할인받은 금액과 정기결제는 전월 이용실적에서 빼지 않으며 앱에서 실적 진행률을 확인할 수 있습니다.",
      "졸업 후 일정 기간 내 해지 시 혜택 환수가 있는 경우 그 조건과 기간([재무·준법 결정 후 기재]).",
      "졸업 조건, 할인율, 한도 등 부가서비스는 변경될 수 있으며, 변경 가능 범위와 사전 고지 방법은 준법 확인 결과에 따라 기재합니다.",
      "졸업 판정을 위해 회원의 결제대금 연체 이력과 월 이용 금액을 활용합니다.",
      "채택 의향과 손익은 가상 고객 시뮬레이션 결과이며 실제 전환율이나 실제 손익이 아닙니다(내부 검토용)."
    ]
  },
  "findings": [
    {
      "id": "guardrail#0",
      "claim": "G1 pass: one_liner가 연습 구간 조건, 졸업 조건, 졸업 후 월 한도 유지, 연체 시 복귀를 모두 담고 hook이 '조건을 지키는 동안 해제'로 바뀌어 1차 지적이 해소됐다. 졸업 이용 조건의 금액이 정해진 뒤 재대조가 필요하다.",
      "type": "estimate",
      "source_id": null,
      "confidence": "medium"
    },
    {
      "id": "guardrail#1",
      "claim": "G2 pass: 할인과 적립을 별개로 쓰고 합산 비율, 최초·유일 표현을 금지했으며 경쟁 비교에 조사 범위 한계를 밝혀 1차 지적이 해소됐다. 병기 문구의 실제 카피 검토는 design_marketing으로 이월한다.",
      "type": "estimate",
      "source_id": null,
      "confidence": "medium"
    },
    {
      "id": "guardrail#2",
      "claim": "G3 needs_human(준법): 부가서비스 유지 의무와 졸업 규칙의 관계, 약관 신고 대상 여부는 근거 팩에 조문이 없어 사람 확인이 필요하다. 졸업 이용 조건의 금액과 환수 조건이 미정이라 가입 전 고지 문구도 완성되지 않았다.",
      "type": "estimate",
      "source_id": null,
      "confidence": "medium"
    },
    {
      "id": "guardrail#3",
      "claim": "G4 needs_human(개인정보): 그룹사 연계는 없으나 졸업 판정에 연체 이력과 월 이용 금액을 반복 집계하는 처리의 고지·동의 범위는 이번 card에서도 사람 확인이 필요하다.",
      "type": "estimate",
      "source_id": null,
      "confidence": "medium"
    },
    {
      "id": "guardrail#4",
      "claim": "G5 pass: 투자 연계가 없고 혜택은 할인과 적립뿐이다.",
      "type": "estimate",
      "source_id": null,
      "confidence": "medium"
    },
    {
      "id": "guardrail#5",
      "claim": "G6 fix: 체리피커 채택자의 0.38, 손익 -0.45로 precheck 플래그가 유지된다. 방어의 핵심인 월 이용 금액 기준의 금액이 입력에 없고 환수가 미정이며, 시뮬레이션에 금액 기준과 0.5% 적립 비용이 반영되지 않아 대비가 충분하다고 판단할 수 없다.",
      "type": "estimate",
      "source_id": null,
      "confidence": "medium"
    }
  ],
  "sources": [],
  "assumptions": [
    "수치는 입력의 card, metrics, twin 값만 인용했다.",
    "근거 팩에 법령 조문이 없어 부가서비스 유지 의무, 약관 신고, 개인정보 동의 요건은 조문을 특정하지 않고 needs_human으로 두었다.",
    "졸업 이용 조건의 금액은 입력에 없어 숫자를 만들지 않았고 required_disclosures에 기재 자리로만 표시했다.",
    "광고 심의 기준 원문이 없어 자체 점검 목록으로 보았다."
  ],
  "unresolved": [
    "졸업 이용 조건의 월 이용 금액 기준은 재무 원가 검증 전이라 값이 없다.",
    "졸업 후 일정 기간 내 해지 시 혜택 환수 여부와 기간은 재무와 준법 결정 전이다.",
    "졸업 판정 시점, 연체 정의, 복귀 후 재졸업 조건은 입력에 없어 상품팀 확인 필요.",
    "졸업 후 한도만 받고 해지하는 행동의 규모는 내부 데이터 확인 필요.",
    "부가서비스 유지 의무와 졸업 상태 변경의 관계는 현행 규정 원문 미확인으로 준법 확인 필요."
  ],
  "limits": [
    "법률 판단을 대체하지 않으며 needs_human 항목은 담당 부서 확인이 필요하다.",
    "채택 의향과 유형별 손익은 가상 고객 시뮬레이션 결과이며 실제 전환율이 아니다.",
    "미달 월 0.5% 적립 비용과 졸업 이용 금액 기준은 시뮬레이션에 들어가지 않았다.",
    "컨셉 재작업 상한 1회가 소진되어 남은 fix는 컨셉 재작업으로 돌리지 않는다.",
    "광고 심의 기준 원문이 없다."
  ],
  "clarifications": [],
  "out_of_scope": {
    "detected": false,
    "suggested_agent": null
  },
  "followups": [
    "졸업 이용 조건의 금액 후보를 재무가 정하면 시뮬레이션을 다시 돌려줘",
    "준법과 개인정보에 넘길 확인 질문 목록으로 정리해줘",
    "병기 문구를 반영한 광고 카피 초안을 광고심의 검토용으로 정리해줘"
  ],
  "input_refs": [
    "08-guardrail/in.json"
  ]
}