{
  "run_id": "sample-guardrail-001",
  "request_id": "sample-guardrail-001-r1",
  "agent": "guardrail",
  "contract_version": "1.0",
  "model": "claude-sonnet-5-5",
  "status": "ok",
  "answer": "6개 점검 중 fix 3건(G1 이름·약속, G2 광고 표현, G6 체리피킹), 확인 필요 3건(G3 고지, G4 개인정보, G5 투자권유), pass 0건이다. 이름과 약속이 실제 구조보다 투자 수익을 연상시키므로 문구 수정이 필요하고, G3~G5는 법무·준법·개인정보 담당자의 확인이 필요하다. 법률 판단을 대체하지 않는다.",
  "result": {
    "checks": [
      {
        "id": "G1",
        "item": "이름·한 줄 약속과 실제 작동 방식 일치(과장·불일치)",
        "status": "fix",
        "finding": "이름 '같이굴려요'(굴리다=자산을 불린다는 뉘앙스)와 약속 '공동 투자 보너스가 쌓이는'은 원금이 아닌 적립 포인트의 일부와 보너스 포인트로 ETF를 소수점 매수한다는 실제 구조보다 강하다. 몇 가지가 어긋난다. (a) '공동 투자'는 공동 소유나 공동 운용으로 읽히지만 풀은 모임 합의로 종목만 고르고 지분은 개인별로 귀속된다고 되어 있다. 귀속 시점과 방식(풀 포인트가 매수 전 누구 몫인지, 탈퇴·해산 시 처리)이 mechanics에 없다. (b) '보너스가 쌓이는'은 챌린지 달성 시에만 지급되고 한도가 있는데 무조건 쌓이는 것처럼 읽힌다. (c) 보너스는 ETF로 전환되므로 가치가 변동하며, 이름에는 이 점이 드러나지 않는다. 투자 성과를 약속하는 문구는 아니지만 오인 소지는 있다. 제공된 메트릭상 topReject가 inertia라서 이름이 과장 기대를 만들면 해지·불만으로 이어질 위험도 있다.",
        "suggestion": "한 줄 약속을 '모임 챌린지를 달성하면 보너스 포인트가 모임 풀에 더해지고, 풀은 각자 지분으로 ETF 소수점 매수에 쓰이는 카드'로 바꾼다. 가입 화면에 '포인트 기반 보너스이며 ETF 가치는 변동되고 원금 보장이 아님', '챌린지 달성 시에만, 월 한도 내 지급'을 한 문장으로 병기한다. 이름은 유지해도 되지만 광고 전반에 '굴려서 불린다'는 수익 뉘앙스의 카피는 쓰지 않는다. 최종 상표·네이밍 적정성은 준법 확인을 거친다.",
        "owner_dept": "상품"
      },
      {
        "id": "G2",
        "item": "광고 표현 위험(단정·과장·오인 소지, 합산 혜택 오인)",
        "status": "fix",
        "finding": "적립률(외식 1.2%, 온라인 0.8%)과 카테고리 한도(capPerCat 3)가 있는데, 풀 합산이 '추가 혜택'처럼 보이면 총 적립률이 높아 보이는 오인이 생긴다. 실제로는 개인 적립의 일부를 풀로 옮기는 것('일부 합산', 개인 적립은 별도 유지)이라 모임 합산 비율이 불명확하다. 일부 비율이 얼마인지 mechanics에 없고, '일부'가 개인 적립을 줄이는지 아닌지도 모호하다. 또 '친구와 함께하면 더 번다'식 표현은 수익 단정으로 읽힐 수 있다.",
        "suggestion": "풀 합산 비율을 수치로 확정하고(이 문서에서는 값을 추정하지 않음, 상품팀 확정 필요) 광고에는 '개인 적립 중 OO%가 풀로 이동(개인 적립 별도 유지 여부 명시)', '챌린지 보너스는 조건 충족 시 한도 내 지급'을 같은 크기 글씨로 표기한다. '더 번다', '불어난다', '수익' 같은 단정·수익 암시 표현은 제외하고 '적립', '보너스 포인트'로 통일한다. 표시광고 심의는 준법 사전심의 대상으로 올린다.",
        "owner_dept": "광고심의"
      },
      {
        "id": "G3",
        "item": "부가서비스 변경 제한·혜택 지급 조건 고지",
        "status": "needs_human",
        "finding": "챌린지 조건('모임 전원 투자 계좌 자동이체 유지')과 보너스 한도가 '가입 화면에 명시'로만 되어 있다. 이 조건들을 연회비·부가서비스 약관상 어떻게 취급하는지(변경 시 고지 기간, 변경 제한 범위, 중도 변경 시 기 적립분 처리)는 이 입력으로는 판단할 수 없다. 특히 한 명이 자동이체를 해지하면 나머지 전원이 보너스를 못 받는 설계라 불이익이 타인 행위에서 비롯되는 점, 조건 변경 시 기존 모임 처리 방식이 비어 있다.",
        "suggestion": "법무·준법에서 부가서비스 변경 제한 규정의 적용 여부와 고지 방식을 확인한다. 설계 측면에서는 (a) 챌린지 조건을 약관·상품설명서 문구와 동일하게 두고, (b) 조건 변경 시 사전 고지 기간과 기 달성 진행분 인정 규칙을 정하고, (c) '전원 달성' 대신 '달성 인원 비례 지급' 또는 이탈자 제외 후 재계산 규칙을 검토한다.",
        "owner_dept": "준법"
      },
      {
        "id": "G4",
        "item": "그룹사(증권·보험·은행) 연계 시 개인정보 결합·제3자 제공 동의",
        "status": "needs_human",
        "finding": "links에 증권(sec)이 있고, 챌린지는 모임 구성원 각자의 투자 계좌 자동이체 유지 여부를 확인해야 하며, 풀 구성과 개인 지분을 앱에서 서로 보이게 한다. 이 과정에서 (a) 카드사와 증권사 간 정보 이용·제공, (b) 모임원 간 타인의 이체 이행 여부·지분 정보 노출, (c) 초대 과정에서 타인 연락처 이용이 발생할 수 있다. 어떤 정보가 누구에게 보이는지가 입력에 정의되어 있지 않다.",
        "suggestion": "법무·준법·개인정보 담당이 결합·제공 근거와 동의 구조(항목별 분리 동의, 선택 동의 거부 시 불이익 없음)를 확인한다. 설계상 최소 노출 원칙으로 모임원에게는 '챌린지 달성 여부'만 보이고 개인 지분 금액·계좌 정보·이체 금액은 비공개로 하는 방안을 우선 검토한다. 동의하지 않은 모임원이 있을 때의 처리(해당 인원 제외)도 정한다.",
        "owner_dept": "개인정보"
      },
      {
        "id": "G5",
        "item": "투자 연계 상품의 투자권유·원금 손실 오인",
        "status": "needs_human",
        "finding": "포인트로 ETF를 매수하는 구조라 손실 가능성이 있는데 mechanics에 손실 고지가 없다. 또 '모임 합의로 ETF 선택'은 종목 선택 과정에서 카드사나 앱이 특정 ETF를 추천·노출하면 투자권유로 해석될 여지가 있고, 모임이 함께 운용하는 모습이 공동 투자나 일종의 집합 운용으로 비칠 수 있는지도 이 입력만으로 판단할 수 없다. 카드 앱이 중개하는지 증권사 앱에서 실행되는지, 포인트→주식 전환 주체도 정의가 없다. 포인트 가치와 원금 개념이 다르므로 '손실 시 포인트가 줄어든다'는 오인도 가능하다.",
        "suggestion": "법무·준법에서 투자권유·투자중개·집합투자 해당 여부를 확인한다. 설계 측면에서는 (a) 카드 화면에서 종목 추천·순위·수익률 비교를 하지 않고 증권사가 제공하는 종목 목록만 노출, (b) 매수 직전 '투자 대상은 가치가 변동하며 손실이 발생할 수 있음, 포인트 적립은 예금자보호 대상이 아님'을 필수 고지, (c) 개인별 소유가 증권사 계좌에 귀속된다는 점과 모임 해산·탈퇴 시 처리 방식을 약관과 화면에 명시한다.",
        "owner_dept": "법무"
      },
      {
        "id": "G6",
        "item": "체리피킹·역선택 대비(채택 고객 유형별 손익 참고)",
        "status": "fix",
        "finding": "제공된 값 기준으로 정적 손익은 7.95인데 채택 고객 기준은 5.4로 낮아지고, 체리피커는 채택자의 0.21(21%)이며 손익은 2.47, 휴면 위험형은 채택자의 0.15(15%)에 손익 0.5로 거의 이익이 없다. 일반형 7.41과 충성형 8.33이 이익을 지탱한다. 채택자의 약 36%(0.21+0.15)가 낮은 이익 유형이다. 구조적 취약점이 있다. (a) 2~5명 모임을 지인·가족·본인 다계정으로 만들어 풀 보너스만 챙기는 '모임 파밍'이 가능하다. (b) 챌린지 조건이 자동이체 유지라서, 달성 후 즉시 해지하는 식의 단기 이용이 방어되지 않는다. (c) 보너스 한도는 있으나 모임 수 상한(1인당 참여 모임 수)이 명시되지 않았다. 이 문서는 채택률·손익을 새로 추정하지 않으며 위 수치는 입력값 인용이다.",
        "suggestion": "(a) 1인 1모임으로 제한하고 모임 구성원은 카드 발급 후 일정 기간(예: 개월 수는 상품팀 확정) 경과 고객으로 제한한다. (b) 보너스는 챌린지 3회 이상 연속 달성 후 지급하거나 보너스 지급 후 일정 기간 자동이체 유지를 요건으로 한다(조건은 약관 고지 필수). (c) 월 보너스 한도와 모임당 총 한도를 모두 설정한다. (d) 동일 기기·동일 주소·가족 관계 등 이상 패턴 모니터링 규칙은 준법·리스크 부서와 정한다. (e) 휴면 위험형 15%에 대해서는 챌린지가 활동 유도 장치가 되는지 소규모 실험으로 확인한다.",
        "owner_dept": "상품"
      }
    ],
    "name_mechanism_consistent": false,
    "overall": "이름과 약속은 투자 수익을 연상시켜 실제 구조(적립 포인트 일부와 한도 내 보너스를 개인 지분으로 ETF에 소수점 매수)보다 강하게 읽히므로 문구 수정이 필요하고, 부가서비스 고지·개인정보 결합·투자권유 해당 여부는 사람(법무·준법)의 확인이 필요하며 모임 파밍을 막는 한도와 요건도 보강해야 한다.",
    "required_disclosures": [
      "투자 대상은 가치가 변동하며 손실이 발생할 수 있고, 포인트 적립은 예금자보호 대상이 아님",
      "보너스 포인트는 챌린지 달성 시에만, 월 한도 내에서 지급됨",
      "개인 적립 중 모임 풀로 이동하는 비율과 개인 적립 별도 유지 여부",
      "풀의 개인 지분 귀속 방식과 모임 탈퇴·해산 시 처리",
      "챌린지 조건과 보너스 한도의 변경 시 사전 고지 방식"
    ]
  },
  "findings": [
    {
      "id": "guardrail#0",
      "claim": "G1 fix: 이름 '같이굴려요'(굴리다=자산을 불린다는 뉘앙스)와 약속 '공동 투자 보너스가 쌓이는'은 원금이 아닌 적립 포인트의 일부와 보너스 포인트로 ETF를 소수점 매수한다는 실제 구조보다 강하다.",
      "type": "estimate",
      "source_id": null,
      "confidence": "medium"
    },
    {
      "id": "guardrail#1",
      "claim": "G2 fix: 적립률(외식 1.2%, 온라인 0.8%)과 카테고리 한도(capPerCat 3)가 있는데, 풀 합산이 '추가 혜택'처럼 보이면 총 적립률이 높아 보이는 오인이 생긴다.",
      "type": "estimate",
      "source_id": null,
      "confidence": "medium"
    },
    {
      "id": "guardrail#2",
      "claim": "G3 needs_human: 챌린지 조건('모임 전원 투자 계좌 자동이체 유지')과 보너스 한도가 '가입 화면에 명시'로만 되어 있다.",
      "type": "estimate",
      "source_id": null,
      "confidence": "medium"
    },
    {
      "id": "guardrail#3",
      "claim": "G4 needs_human: links에 증권(sec)이 있고, 챌린지는 모임 구성원 각자의 투자 계좌 자동이체 유지 여부를 확인해야 하며, 풀 구성과 개인 지분을 앱에서 서로 보이게 한다.",
      "type": "estimate",
      "source_id": null,
      "confidence": "medium"
    },
    {
      "id": "guardrail#4",
      "claim": "G5 needs_human: 포인트로 ETF를 매수하는 구조라 손실 가능성이 있는데 mechanics에 손실 고지가 없다.",
      "type": "estimate",
      "source_id": null,
      "confidence": "medium"
    },
    {
      "id": "guardrail#5",
      "claim": "G6 fix: 제공된 값 기준으로 정적 손익은 7.95인데 채택 고객 기준은 5.4로 낮아지고, 체리피커는 채택자의 0.21(21%)이며 손익은 2.47, 휴면 위험형은 채택자의 0.15(15%)에 손익 0.5로 거의 이익이 없다.",
      "type": "estimate",
      "source_id": null,
      "confidence": "medium"
    }
  ],
  "sources": [],
  "assumptions": [
    "입력의 card, metrics, twin 값만 인용한다.",
    "광고 심의 기준 원문이 없어 자체 점검 목록으로 본다."
  ],
  "unresolved": [
    "풀 합산 비율, 보너스 한도 금액, 모임 해산·탈퇴 시 처리는 입력에 없어 확인 불가(상품팀 확인 필요)."
  ],
  "limits": [
    "법률 판단을 대체하지 않으며 needs_human 항목은 담당 부서 확인이 필요하다.",
    "광고 심의 기준 원문이 없다."
  ],
  "clarifications": [],
  "out_of_scope": {
    "detected": false,
    "suggested_agent": null
  },
  "followups": [
    "fix 3건을 반영해서 컨셉을 다시 다듬어줘",
    "법무에 넘길 확인 질문 목록으로 정리해줘",
    "체리피킹 방어 조건을 넣으면 채택 의향이 어떻게 달라질까?"
  ],
  "input_refs": [
    "winner.card",
    "winner.metrics",
    "validation.result.twin"
  ],
  "validation": {
    "passed": true,
    "warnings": [],
    "rejects": []
  }
}
