{
  "run_id": "a0",
  "request_id": "a0-validation-r1",
  "agent": "validation",
  "contract_version": "1.0",
  "model": "claude-sonnet-5-5",
  "status": "ok",
  "answer": "가상 고객 시뮬레이션(가정 기반) 결과, GenZ(만 19~29세) 채택 의향은 40.8%로 목표 0.38 이상이고 채택 고객 손익 2.58이 하한 1.5 이상이라 채택 게이트 기준을 넘는다. 다만 체리피커가 채택자의 40.0%이고 휴면 위험형 손익 1.48은 하한 1.5에 못 미치며, 혜택 20% 축소(29.8%)와 시장 위축(32.2%) 시나리오에서는 목표 아래다. 이 수치는 실제 전환율이 아니다.",
  "result": {
    "twin": {
      "n_personas": 1200,
      "seed": 11,
      "target_adopt": 0.408,
      "all_segments_adopt": {
        "GenZ(만 19~29세)": 0.408,
        "사회초년생(25-29)": 0.465
      },
      "by_type": {
        "일반형": {
          "share_of_adopters": 0.39,
          "profit": 3.43
        },
        "혜택 사냥꾼(체리피커)": {
          "share_of_adopters": 0.4,
          "profit": 1.93
        },
        "충성형": {
          "share_of_adopters": 0.04,
          "profit": 5.75
        },
        "휴면 위험형": {
          "share_of_adopters": 0.17,
          "profit": 1.48
        }
      },
      "adopter_profit": 2.58,
      "static_profit": 3.17,
      "behav_floor": 1.5,
      "scenarios": [
        {
          "name": "기본",
          "adopt": 0.408
        },
        {
          "name": "경쟁사 모방(새로움 50%↓)",
          "adopt": 0.393
        },
        {
          "name": "혜택 20% 축소",
          "adopt": 0.298
        },
        {
          "name": "시장 위축",
          "adopt": 0.322
        }
      ],
      "top_reject": "inertia"
    },
    "voices": [
      {
        "type": "일반형",
        "quote": "외식·배달, 온라인쇼핑, 구독 중 제일 많이 쓴 영역이 알아서 1위로 잡힌다니 혜택을 고르는 수고가 없어서 좋아요. 연회비 0.5만원은 부담이 크지 않은데, 전월 이용실적 10만원을 못 채운 달에는 캐시백이 없다는 점은 제 사용량을 확인해 봐야겠어요.",
        "would_adopt": true,
        "main_concern": "전월 이용실적 10만원을 못 채운 달에는 캐시백이 적용되지 않고, 영역별 월 한도 5천원이라 체감 혜택이 작을 수 있다는 점"
      },
      {
        "type": "체리피커",
        "quote": "1위 영역에는 1.1%, 나머지는 0.3%라서 1위로 잡힌 영역에서 영역별 한도 5천원에 닿을 만큼만 이 카드로 긁고 나머지는 다른 카드로 돌릴 거예요. 월말에 몰아 결제해서 영역을 바꾸는 건 3개월 합계 판정이라 어려워 보이네요. 전월 이용실적 10만원은 부담이 낮아서 쉽게 맞출 수 있어요.",
        "would_adopt": true,
        "main_concern": "한도 5천원까지만 받고 빠지는 구조가 유지될지, 앱이 중간 집계 표시와 고지로 영역 변경을 어디까지 허용하는지 불분명하다는 점",
        "exploit_or_risk": "활용·우회 경로: 발급 후 3개월 미만은 이용한 달까지의 합계로 1위를 판정하므로 첫 달에 원하는 영역에 결제를 몰아 1위를 선점하고, 이후에는 그 영역 캐시백이 월 한도 5천원에 닿을 만큼만 쓰고 나머지 영역 소비는 다른 카드로 돌리는 방식이 남습니다. 전월 이용실적 10만원은 낮은 기준이라 소액 결제로 맞추고 연회비 0.5만원 대비 캐시백이 앞서는 달만 쓰다 1년 내 해지할 수 있습니다. 막힌 곳: 3개월 합계 판정으로 월말 하루 몰아 결제해 1위를 바꾸기 어렵고, 연 단위 구독 결제는 12개월로 나눠 반영돼 한 번의 큰 결제로 구독·디지털을 1위로 올릴 수 없으며, 할부·취소 건과 상품권·선불충전 결제는 실적과 판정 이용액에서 제외됩니다. 운영 점검 포인트는 발급 초기 3개월의 영역 집중 결제, 한도 도달 직후 이용 급감, 1년 내 해지 비율입니다."
      },
      {
        "type": "충성형",
        "quote": "지금 쓰는 카드에 익숙해서 굳이 바꿀 이유는 아직 못 느껴요. 앱에서 매달 배정 결과와 산정 근거를 보여 주고 구독 결제 일정도 한곳에 모아 준다면, 옮긴 뒤에는 이 카드로 소비를 몰아 줄 수 있을 것 같아요.",
        "would_adopt": false,
        "main_concern": "기존 카드를 정리하고 옮길 만큼 1.1%와 0.3% 캐시백 차이가 크게 느껴지지 않는다는 점"
      },
      {
        "type": "휴면 위험형",
        "quote": "간편결제에 등록은 해 두겠지만 평소에는 원래 쓰던 결제수단을 더 쓸 것 같아요. 구독 알림은 편해 보여도 캐시백은 영역별 월 한도 5천원이라 이 카드를 꼭 꺼내 쓸 이유가 크지 않아요.",
        "would_adopt": false,
        "main_concern": "소비의 일부만 이 카드로 쓰게 되어 캐시백을 거의 받지 못하고 카드가 서랍에 남을 것 같다는 점"
      }
    ],
    "summary": "가상 고객 시뮬레이션(가정 기반) 결과이며 실제 전환율이 아니다. 가상 고객 1200명(시드 11) 기준 GenZ(만 19~29세) 채택 의향은 40.8%(사회초년생(25-29) 46.5%)로 목표 0.38 이상이고, 채택 고객 1인당 손익은 2.58(만원/년)로 하한 1.5 이상이어서 채택 게이트 기준을 넘지만 정적 손익 3.17보다는 낮다. 채택자 유형은 일반형 39.0%(손익 3.43), 체리피커 40.0%(1.93), 충성형 4.0%(5.75), 휴면 위험형 17.0%(1.48)이며, 체리피커 비중이 가장 크고 휴면 위험형 손익 1.48은 하한 1.5에 못 미친다. 시나리오별 채택 의향은 기본 40.8%, 경쟁사 모방(새로움 50%↓) 39.3%, 혜택 20% 축소 29.8%, 시장 위축 32.2%로, 앞의 둘은 0.38 이상이고 뒤의 둘은 목표 아래이며 최다 거절 사유는 inertia이다. 컨셉 단계에서는 휴면 위험형이 소비를 이 카드로 옮길 이유(구독 장부의 사용 빈도, 영역별 월 한도 5천원의 체감 크기)와 체리피커의 초기 3개월 영역 선점을 줄이는 판정 규칙을 점검할 필요가 있다. 유형별 반응은 역할극이며 통계가 아니다."
  },
  "findings": [
    {
      "id": "validation#0",
      "claim": "기본 시나리오 GenZ(만 19~29세) 채택 의향은 40.8%이고 채택 고객 손익은 2.58로, 목표 0.38과 하한 1.5를 모두 넘는다(가상 고객 시뮬레이션, 실제 전환율 아님).",
      "type": "estimate",
      "source_id": null,
      "confidence": "medium"
    },
    {
      "id": "validation#1",
      "claim": "체리피커가 채택자의 40.0%로 가장 크고 휴면 위험형 손익은 1.48로 하한 1.5에 못 미친다.",
      "type": "estimate",
      "source_id": null,
      "confidence": "medium"
    },
    {
      "id": "validation#2",
      "claim": "혜택 20% 축소 시 채택 의향 29.8%, 시장 위축 시 32.2%로 목표 0.38 아래이고, 경쟁사 모방 시 39.3%는 목표 이상이다.",
      "type": "estimate",
      "source_id": null,
      "confidence": "medium"
    }
  ],
  "sources": [],
  "assumptions": [
    "이 카드는 컨셉 후보 중 선정안이 아닌 후보를 사람이 선택해 진행하는 경로의 카드이며, 입력의 카드·시뮬레이션 수치만 근거로 썼다.",
    "시뮬레이션은 PM 가정치 기반 효용 모형이고 채택 의향 40.8%는 실제 전환율이 아니다.",
    "유형별 반응은 persona_types의 행동 특성에 따른 역할극이다."
  ],
  "unresolved": [
    "휴면 위험형 손익 1.48이 하한 1.5에 못 미치는 원인과 개선 설계는 이번 입력으로 확인되지 않는다.",
    "3개월 합계 판정과 구독 반복 결제 식별의 월 단위 처리 가능 여부는 내부 데이터 확인 필요."
  ],
  "limits": [
    "모형은 PM 가정치로 만들었고 세그먼트 규모 변화에 둔감할 수 있다.",
    "내부 성과·회원·결제 데이터는 볼 수 없다.",
    "배정 기준 고지와 결제 내역 활용 동의 범위는 사람 확인 필요."
  ],
  "clarifications": [],
  "out_of_scope": {
    "detected": false,
    "suggested_agent": null
  },
  "followups": [
    "휴면 위험형 손익이 하한을 넘도록 영역별 월 한도나 구독 장부 기능을 조정한 안을 다시 시뮬레이션할지 검토"
  ],
  "input_refs": [
    "payload.card",
    "payload.metrics",
    "payload.persona_types",
    "payload.twin"
  ]
}