{
  "run_id": "b0",
  "request_id": "b0-trend-r2",
  "agent": "trend",
  "contract_version": "1.0",
  "model": "claude-sonnet-5-5",
  "status": "ok",
  "answer": "제공된 근거 문서에서 규제, 프로모션, 제휴·그룹, 혜택 관점의 시그널 4개(T1~T4)를 정리했다. 연령 범위가 없는 자료가 많고 숏폼 플랫폼 이용 비중, 간편결제 앱 내 카드 노출 방식, 조건부 캐시백 광고 심의 사례는 문서에서 찾지 못했다.",
  "result": {
    "signals": [
      {
        "id": "T6",
        "title": "여신전문금융업법 시행령 개정으로 신용카드 결제 금지 대상과 모집 경제적 이익 한도 명시(2026-05-06 시행)",
        "topic": "regulation",
        "direction": "rising",
        "period": "2026-05 시행",
        "strength": 0.7,
        "reliability": 0.9,
        "impl": "확인한 것: 연회비 100분의 100 초과 경제적 이익 모집 금지와 선불수단 월 1백만원 한도가 시행령에 있다(IVS19). 해석: 가입 혜택과 충전형 결제 설계는 이 한도 안에서 검토하며 적용 범위는 사람 확인 필요.",
        "source_ids": [
          "IVS19"
        ],
        "research_topic": "조건부 캐시백·환급 혜택을 다룬 카드 광고의 심의 사례"
      },
      {
        "id": "T7",
        "title": "금감원 해외투자 관련 현금성 이벤트·광고 중단 조치와 거래금액 비례 이벤트 제도개선 추진",
        "topic": "promo",
        "direction": "rising",
        "period": "2025-12 발표, 2026-03까지 중단",
        "strength": 0.4,
        "reliability": 0.9,
        "impl": "확인한 것: 해외투자 관련 신규 현금성 이벤트·광고를 2026년 3월까지 중단하도록 했다(IVS20). 해석: 투자 연계는 이번 범위에서 제외되므로 직접 적용은 없고, 이벤트 설계 때 참고하는 규제 방향으로만 둔다.",
        "source_ids": [
          "IVS20"
        ],
        "research_topic": "조건부 캐시백·환급 혜택을 다룬 카드 광고의 심의 사례"
      },
      {
        "id": "T8",
        "title": "모임통장·모임 체크카드의 가입과 캐시백 유인 확산(은행 2곳 사례, 전 연령 대상 보도)",
        "topic": "group",
        "direction": "rising",
        "period": "2025-02~2025-08",
        "strength": 0.5,
        "reliability": 0.7,
        "impl": "확인한 것: 카카오뱅크 모임 체크카드는 누적 발급 100만장, 캐시백 누적 30억원이고 신한 SOL모임통장은 3개월 만에 회원 40만을 넘었다(GTS3, GTS4). 해석: 모임 단위 혜택은 제휴·그룹 관점의 후보이나 두 보도 모두 연령 범위가 없어 20대 수치는 확인하지 못했다.",
        "source_ids": [
          "GTS3",
          "GTS4"
        ],
        "research_topic": null
      },
      {
        "id": "T9",
        "title": "KB 마라톤카드 이벤트의 이용금액 조건과 라이프스타일 업종 할인 결합 사례",
        "topic": "benefit",
        "direction": "unknown",
        "period": "2026-09",
        "strength": 0.4,
        "reliability": 0.7,
        "impl": "확인한 것: 9월 한 달 100만원 이상 이용·응모 고객 중 추첨 20명에게 참가 자격을 주고 러닝앱·스포츠·OTT 업종 할인을 제공한다(FSS11). 해석: 조건부 혜택 광고는 조건 표기가 핵심이며 카드 광고 심의 사례는 이 문서에 없다.",
        "source_ids": [
          "FSS11"
        ],
        "research_topic": "조건부 캐시백·환급 혜택을 다룬 카드 광고의 심의 사례"
      }
    ],
    "regulatory_changes": [
      {
        "title": "여신전문금융업법 시행령 개정(신용카드 결제 금지 대상, 모집 경제적 이익 한도)",
        "effective_date": "2026-05-06",
        "scope": "신용카드 결제 금지 대상(금융투자상품, 가상자산 관련 지급), 개인회원 선불수단 월 1백만원 한도, 연회비 100분의 100 초과 경제적 이익 모집 금지",
        "source_id": "IVS19"
      }
    ]
  },
  "findings": [
    {
      "id": "trend#0",
      "claim": "여신전문금융업법 시행령은 자본시장법상 금융투자상품과 가상자산 관련 금전 지급을 신용카드 결제 금지 대상으로 정한다.",
      "type": "fact",
      "source_id": "IVS19",
      "confidence": "high"
    },
    {
      "id": "trend#1",
      "claim": "개인 신용카드회원의 선불카드·선불전자지급수단·상품권 구입은 월 1백만원 이용한도를 넘으면 결제 금지 대상이다.",
      "type": "fact",
      "source_id": "IVS19",
      "confidence": "high"
    },
    {
      "id": "trend#2",
      "claim": "신용카드 모집 시 연회비의 100분의 100을 넘는 경제적 이익을 주는 모집은 금지된다.",
      "type": "fact",
      "source_id": "IVS19",
      "confidence": "high"
    },
    {
      "id": "trend#3",
      "claim": "금감원은 해외투자 관련 신규 현금성 이벤트·광고를 2026년 3월까지 중단하도록 했고 주식(1주) 제공도 포함했다.",
      "type": "fact",
      "source_id": "IVS20",
      "confidence": "high"
    },
    {
      "id": "trend#4",
      "claim": "금감원은 거래금액 비례 이벤트를 원천 금지하는 방향으로 제도개선을 추진한다고 밝혔다.",
      "type": "fact",
      "source_id": "IVS20",
      "confidence": "high"
    },
    {
      "id": "trend#5",
      "claim": "카카오뱅크 모임 체크카드 누적 발급량이 100만장을 돌파했고 캐시백은 2025년 7월 말까지 누적 30억원이다.",
      "type": "fact",
      "source_id": "GTS3",
      "confidence": "medium"
    },
    {
      "id": "trend#6",
      "claim": "신한은행 SOL모임통장은 2025년 2월 출시 후 3개월 만에 회원 40만을 돌파했고 입금액 비례 모임지원금 이벤트를 진행했다.",
      "type": "fact",
      "source_id": "GTS4",
      "confidence": "medium"
    },
    {
      "id": "trend#7",
      "claim": "KB 마라톤카드는 9월 한 달 100만원 이상 이용·응모 고객 중 추첨 20명에게 도쿄 마라톤 2027 참가 자격을 준다.",
      "type": "fact",
      "source_id": "FSS11",
      "confidence": "medium"
    },
    {
      "id": "trend#8",
      "claim": "KB 마라톤카드는 러닝앱 티켓·스토어, 스포츠 업종, OTT, 병원·약국에서 할인한다.",
      "type": "fact",
      "source_id": "FSS11",
      "confidence": "medium"
    },
    {
      "id": "trend#9",
      "claim": "IVS20의 이벤트 규제는 해외투자 영역이므로 투자 연계를 제외한 이번 카드 기획에는 참고 수준이다.",
      "type": "estimate",
      "source_id": "IVS20",
      "confidence": "low"
    }
  ],
  "sources": [
    {
      "id": "IVS19",
      "title": "여신전문금융업법 시행령 [시행 2026.5.6.] 대통령령 제36314호",
      "url": "https://www.law.go.kr/LSW/lsInfoP.do?lsiSeq=285799",
      "publisher": "법제처",
      "kind": "official",
      "published": "2026-05-06",
      "retrieved_at": "2026-10-23",
      "reliability": 0.9,
      "tier": "A",
      "stale": false
    },
    {
      "id": "FSS11",
      "title": "KB국민카드, 마스터카드와 '도쿄 마라톤 2027' 출전권 이벤트",
      "url": "https://biz.sbs.co.kr/amp/article/20000335175",
      "publisher": "SBS Biz",
      "kind": "news",
      "published": "2026-09-17",
      "retrieved_at": "2026-10-23",
      "reliability": 0.7,
      "tier": "B",
      "stale": false
    },
    {
      "id": "LNS12",
      "title": "Freedom Rise credit limit increases",
      "url": "https://www.chase.com/personal/credit-cards/education/basics/freedom-rise-credit-limit-increase",
      "publisher": "Chase",
      "kind": "official",
      "published": null,
      "retrieved_at": "2026-10-23",
      "reliability": 0.9,
      "tier": "A"
    },
    {
      "id": "LNS14",
      "title": "Platinum Secured Credit Card",
      "url": "https://www.capitalone.com/credit-cards/platinum-secured/",
      "publisher": "Capital One",
      "kind": "official",
      "published": null,
      "retrieved_at": "2026-10-23",
      "reliability": 0.9,
      "tier": "A"
    },
    {
      "id": "PFS14",
      "title": "Bilt Mastercard / Bilt Card 2.0 공식 페이지",
      "url": "https://www.biltrewards.com/card",
      "publisher": "Bilt",
      "kind": "web",
      "published": null,
      "retrieved_at": "2026-10-23",
      "reliability": 0.5,
      "tier": "C"
    },
    {
      "id": "PFS16",
      "title": "Petal 공식 페이지",
      "url": "https://www.petalcard.com/",
      "publisher": "Petal",
      "kind": "web",
      "published": null,
      "retrieved_at": "2026-10-23",
      "reliability": 0.5,
      "tier": "C"
    },
    {
      "id": "GTS3",
      "title": "카카오뱅크, ‘모임 체크카드’ 출시 1년여 만에 누적 100만장 돌파",
      "url": "https://www.heraldk.com/article/2025081317211700327",
      "publisher": "헤럴드경제",
      "kind": "news",
      "published": "2025-08-13",
      "retrieved_at": "2026-10-23",
      "reliability": 0.7,
      "tier": "B",
      "stale": false
    },
    {
      "id": "GTS4",
      "title": "신한은행, SOL모임통장 회원수 40만 돌파",
      "url": "https://www.smarttoday.co.kr/ko-kr/articles/80716",
      "publisher": "스마트투데이",
      "kind": "news",
      "published": "2025-05-14",
      "retrieved_at": "2026-10-23",
      "reliability": 0.7,
      "tier": "B",
      "stale": false
    },
    {
      "id": "IVS20",
      "title": "투자자 보호 및 리스크관리 강화를 위한 해외투자 실태점검 중간 결과 및 향후 대응방향",
      "url": "https://www.fss.or.kr/fss/bbs/B0000188/view.do?menuNo=200218&nttId=208246",
      "publisher": "금융감독원",
      "kind": "official",
      "published": "2025-12-19",
      "retrieved_at": "2026-10-23",
      "reliability": 0.9,
      "tier": "A",
      "stale": false
    },
    {
      "id": "LNS15",
      "title": "Quicksilver Rewards for Students",
      "url": "https://www.capitalone.com/credit-cards/quicksilver-student/",
      "publisher": "Capital One",
      "kind": "official",
      "published": null,
      "retrieved_at": "2026-10-23",
      "reliability": 0.9,
      "tier": "A"
    },
    {
      "id": "LNS16",
      "title": "Discover it Student Cash Back",
      "url": "https://www.discover.com/credit-cards/student/it-card.html",
      "publisher": "Discover",
      "kind": "official",
      "published": null,
      "retrieved_at": "2026-10-23",
      "reliability": 0.9,
      "tier": "A"
    },
    {
      "id": "SNS7",
      "title": "미성년 자녀의 가족카드 발급허용 등 혁신금융서비스를 제도화하겠습니다 (입법예고 보도자료)",
      "url": "https://www.fsc.go.kr/po010105/86116?curPage=2",
      "publisher": "금융위원회",
      "kind": "official",
      "published": "2026-01-22",
      "retrieved_at": "2026-10-23",
      "reliability": 0.9,
      "tier": "A",
      "stale": false
    }
  ],
  "assumptions": [
    "입력 docs의 facts만 근거로 썼고 웹 검색은 하지 않았다.",
    "GTS3, GTS4, FSS11은 연령 범위를 밝히지 않은 전 연령 대상 보도로 보고 impl에 범위를 적었다."
  ],
  "unresolved": [
    "근거 없음: 만 19~29세 신용카드 신규 발급자의 숏폼·동영상 플랫폼별 이용 비중과 카드 광고 반응",
    "근거 없음: 배달앱·간편결제 앱 안 카드 등록·추천 화면 노출 방식과 20대 이용 수치",
    "근거 없음: 조건부 캐시백·환급 혜택을 다룬 카드 광고의 심의 사례(카드 광고 직접 심의 사례 없음, 이벤트·광고 규제 문서만 확인)"
  ],
  "limits": [
    "LNS12, LNS14, LNS15, LNS16, PFS14, PFS16은 해외 카드 자료이고 SNS7은 미성년 가족카드 자료여서 이번 시그널에서 제외했다.",
    "GTS3, GTS4, FSS11은 20대 표본이 아니고 사례 건수가 적다.",
    "IVS20은 해외투자 영역이며 신용카드 캐시백 광고에 적용되는지는 사람 확인 필요.",
    "PFS14, PFS16, LNS 문서는 발행일이 null이다."
  ],
  "clarifications": [],
  "out_of_scope": {
    "detected": false,
    "suggested_agent": null
  },
  "followups": [
    "여신금융협회 광고 심의 기준에서 조건부 캐시백 표기 확인",
    "20대 숏폼 플랫폼별 이용률은 별도 조사 자료로 보완",
    "카드 광고에 대한 20대 반응은 consumer 에이전트로 확인"
  ],
  "input_refs": [
    "02-trend-evidence/in.json"
  ]
}