{
  "run_id": "genz-credit-001",
  "request_id": "genz-credit-001-whitespace-r2",
  "agent": "whitespace",
  "contract_version": "1.0",
  "model": "claude-opus-5-5",
  "status": "ok",
  "answer": "컨셉 개발로 넘길 기회 셀로 GenZ×구독·디지털(엔진 1위), GenZ×단순함(엔진 5위), GenZ×소속감·소셜(엔진 4위, 시장조사 충돌에서 도출)을 골랐습니다. 엔진 2·3위 사회초년생 셀은 GenZ 안의 25~29세 구간이라 따로 고르지 않고 1순위 셀 안에서 연령 차이로 다뤘습니다. 세 셀 모두 천장이 목표 0.38 이상이며, 소셜 셀은 수요 근거가 가정치뿐이라 소비자 검증이 먼저 필요합니다.",
  "result": {
    "picks": [
      {
        "rank": 1,
        "seg": "genz",
        "need": "digital",
        "engine_rank": 1,
        "rationale": "엔진 1위(0.437)이자 요청 타깃 셀이다. 구독·디지털은 GenZ 니즈 1순위(가중치 0.85, PM 가정치)이고 간편결제 일평균 이용금액이 1조464억원을 넘어 결제 접점이 페이 앱으로 옮겨 갔다(T2). 경쟁 DB에서 ai_personalize는 34종 중 0종이고 auto_best도 체크카드 1종뿐이라, 페이 등록과 앱 내 발급을 기본으로 두고 소비에 맞춰 혜택을 자동으로 맞추는 구조가 빈자리다. 엔진 2위 young×digital(0.385)은 같은 니즈의 25~29세 구간이라 별도 셀로 고르지 않고 이 셀 안에서 연령 차이를 본다. 입력 가정치로 25~29세(young)는 구독·디지털 가중치 0.75, 절약·캐시백 0.8로 절약 비중이 더 크고 천장도 0.635로 GenZ 전체(0.56)보다 높다. 19~24세 구간 수치는 입력에 따로 없으므로, 첫 신용카드 진입층(T4의 금융이력부족 청년)은 디지털 발급 경험을, 25~29세는 생활 소비 적립을 더 반응할 축으로 보는 가정을 두고 컨셉 단계에서 두 구간을 나눠 검증한다.",
        "evidence_ids": [
          "T2",
          "need:digital",
          "tag:ai_personalize"
        ],
        "deviates_from_engine": false,
        "deviation_reason": null,
        "risk": "subscription_ott는 8종으로 GenZ 대상 신용카드 후보들이 공통으로 넣고 있어 구독 할인만으로는 차별점이 약하고, 페이 앱 자체 적립이 카드 혜택과 비슷하면 카드가 휴면화될 수 있다(내부 데이터 확인 필요). T2의 간편결제 수치는 전 연령 지표라 20대 수치는 확인하지 못했다.",
        "origin": "score",
        "ceiling": 0.56,
        "feasible": true
      },
      {
        "rank": 2,
        "seg": "genz",
        "need": "simple",
        "engine_rank": 5,
        "rationale": "엔진 5위(0.338)로 4위 genz×social과 점수가 같다. 단순함은 GenZ 니즈 3순위(가중치 0.7, 복잡도 허용도 0.5)이고 첫 카드 안내 글들이 전월실적 조건과 한도 확인을 반복해 강조한다. 경쟁 DB에서 실적 구간제(tiered_perf)는 10종인데 실적조건 완화(anti_cap)는 0종이라 조건 구조의 공백이 뚜렷하다. 부가서비스 일방 변경 조항에 대한 시정 요구(T5)는 처음부터 지속 가능한 단순 혜택을 설계할 근거가 되고, 청년 금융이력부족자 발급 문턱 완화(T4)로 늘 수 있는 첫 신용카드 수요와도 맞는다. GenZ 셀 가운데 천장이 0.68로 가장 높다.",
        "evidence_ids": [
          "T5",
          "T4",
          "need:simple",
          "tag:anti_cap"
        ],
        "deviates_from_engine": true,
        "deviation_reason": "엔진 2위 young×digital과 3위 young×saving은 25~29세로 GenZ(19~29세) 안에 포함되는 구간이라 genz 셀과 겹친다. 겹치는 셀 대신 요청 타깃 전체를 덮고 천장이 0.68로 높으며 anti_cap 0종 공백이 있는 genz×simple을 2순위로 올렸다.",
        "risk": "실적조건을 풀면 혜택 원가를 통제하기 어려워 혜택 수준이 낮아질 수 있고, 단순함만으로는 발급 동기가 약할 수 있다. T5는 2023년 출처가 포함된 오래된 근거이고 T4의 세부 발급 기준은 사람 확인 필요다.",
        "origin": "score",
        "ceiling": 0.68,
        "feasible": true
      },
      {
        "rank": 3,
        "seg": "genz",
        "need": "social",
        "engine_rank": 4,
        "rationale": "시장조사 충돌 '소셜·공유형 공백이 수요가 있는 빈칸인가'에서 본 셀이다. 경쟁 DB에서 social과 group_pooling은 34종 중 0종, challenge는 1종이라 공급 공백은 분명하다. 소비자 분석은 소속감·소셜 니즈를 4순위(가중치 0.7, PM 가정치)로 두었으나 공개 웹 근거를 찾지 못했고, 트렌드 분석도 제휴·그룹 시그널을 찾지 못했다. 엔진 4위(0.338)로 점수상 genz×simple과 같고, 디지털·단순함 축과 결합해 친구와 혜택 한도를 나눠 쓰는 보조 차별점으로 검토할 만하다. 수요 확인을 컨셉 검증 단계의 선결 과제로 넘긴다.",
        "evidence_ids": [
          "tag:social",
          "tag:group_pooling",
          "need:social"
        ],
        "deviates_from_engine": true,
        "deviation_reason": "엔진 순서로는 young×digital, young×saving이 앞서지만 GenZ 셀과 겹치는 하위 연령 구간이라 제외했고, 시장조사 충돌에서 공백 단서가 나온 genz×social을 3순위로 두었다. 같은 점수의 genz×simple보다 수요 근거가 약해 뒤에 둔다.",
        "risk": "공급이 비어 있는 이유가 수요 부족일 수 있고, 소셜 니즈 근거가 PM 가정치뿐이라 소비자 검증이 먼저 필요하다. 혜택 한도 공유 구조는 운영 복잡도를 높여 단순함 니즈와 충돌할 수 있다.",
        "origin": "tension",
        "ceiling": 0.56,
        "feasible": true
      }
    ]
  },
  "findings": [
    {
      "id": "whitespace#0",
      "claim": "간편결제 일평균 이용금액은 1조464억원으로 전년 동기보다 11.4% 늘었고 전자금융업자 간편결제 비중은 55.1%다.",
      "type": "fact",
      "source_id": "S2",
      "confidence": "high"
    },
    {
      "id": "whitespace#1",
      "claim": "금융당국은 12월부터 청년 등 금융이력부족자의 신용카드 발급에 대안신용평가와 보증금 담보 신용카드를 도입하겠다고 밝혔다.",
      "type": "fact",
      "source_id": "S8",
      "confidence": "high"
    },
    {
      "id": "whitespace#2",
      "claim": "공정위는 사전 고지 없이 부가서비스를 변경·중단할 수 있게 한 카드 약관 조항에 대해 금융위원회에 시정을 요청했다.",
      "type": "fact",
      "source_id": "S10",
      "confidence": "medium"
    },
    {
      "id": "whitespace#3",
      "claim": "young×digital과 young×saving은 GenZ(19~29세)에 포함되는 25~29세 구간이라 genz 셀과 기회가 겹친다고 판단했다.",
      "type": "estimate",
      "source_id": null,
      "confidence": "medium"
    },
    {
      "id": "whitespace#4",
      "claim": "genz×social은 경쟁 공백은 분명하나 수요 근거가 PM 가정치뿐이라 컨셉 검증 단계에서 수요 확인이 먼저 필요하다.",
      "type": "estimate",
      "source_id": null,
      "confidence": "low"
    }
  ],
  "sources": [
    {
      "id": "S2",
      "title": "핸드폰 열고 '터치'…간편결제 이용액 하루 1조원 넘었다",
      "url": "https://www.hankyung.com/article/202509294322i",
      "publisher": "한국경제",
      "kind": "news",
      "published": "2025-09-29",
      "retrieved_at": "2026-10-20",
      "reliability": 0.75,
      "tier": "B",
      "stale": false
    },
    {
      "id": "S3",
      "title": "네이버·카카오·토스페이 각축전, 다음 승부처는 페이스페이가 될까? 2026 결제 서비스 트렌드",
      "url": "https://blog.opensurvey.co.kr/article/payment-2026-2/",
      "publisher": "오픈서베이",
      "kind": "report",
      "published": null,
      "retrieved_at": "2026-10-20",
      "reliability": 0.45,
      "tier": "C"
    },
    {
      "id": "S4",
      "title": "한국은행 2026년 상반기 전자지급서비스 이용 현황(KDI 경제교육·정보센터 게재)",
      "url": "https://eiec.kdi.re.kr/policy/materialView.do?num=287115",
      "publisher": "KDI 경제교육·정보센터",
      "kind": "official",
      "published": null,
      "retrieved_at": "2026-10-20",
      "reliability": 0.8,
      "tier": "A"
    },
    {
      "id": "S8",
      "title": "신용평가에 연체이력 기간 단축…청년·외국인 신용카드 발급 쉬워진다",
      "url": "https://www.heraldk.com/article/2026071419324457780",
      "publisher": "헤럴드경제",
      "kind": "news",
      "published": "2026-07-14",
      "retrieved_at": "2026-10-20",
      "reliability": 0.7,
      "tier": "B",
      "stale": false
    },
    {
      "id": "S9",
      "title": "금융위원회 합동 대통령 업무보고…청년 자산형성 프로그램 추진",
      "url": "https://mobile.newsis.com/view/NISX20260715_0003709462",
      "publisher": "뉴시스",
      "kind": "news",
      "published": "2026-07-15",
      "retrieved_at": "2026-10-20",
      "reliability": 0.7,
      "tier": "B",
      "stale": false
    },
    {
      "id": "S10",
      "title": "금융투자·여신업 약관사항 심사",
      "url": "https://www.dt.co.kr/article/11209940",
      "publisher": "디지털타임스",
      "kind": "news",
      "published": null,
      "retrieved_at": "2026-10-20",
      "reliability": 0.45,
      "tier": "B"
    },
    {
      "id": "S11",
      "title": "공정위, 여신전문금융회사 약관 시정 요청 보도",
      "url": "https://www.kukinews.com/article/view/kuk202311080233",
      "publisher": "쿠키뉴스",
      "kind": "news",
      "published": "2023-11-08",
      "retrieved_at": "2026-10-20",
      "reliability": 0.5,
      "tier": "B",
      "stale": true
    }
  ],
  "assumptions": [
    "코드가 계산한 셀 점수, 순위, 천장을 그대로 사용했고 점수를 다시 매기지 않았다.",
    "목표 채택 의향 0.38은 PM 가정치이며 feasible은 천장이 0.38 이상인지로 표시했다.",
    "19~24세 구간의 니즈 수치는 입력에 없어 GenZ 전체와 25~29세(young) 가정치의 차이로 연령 차이를 추정했다."
  ],
  "unresolved": [
    "19~24세와 25~29세의 실제 니즈와 결제 행태 차이(내부 데이터 확인 필요)",
    "페이 앱 자체 적립과 카드 혜택의 크기 비교(내부 데이터 확인 필요)",
    "소셜·공유형 혜택의 실제 수요",
    "대안신용평가 기반 발급의 세부 기준(사람 확인 필요)"
  ],
  "limits": [
    "점수식 가중치와 세그먼트 니즈 가중치는 PM 가정치다.",
    "경쟁 태그 집계는 경쟁 카드 DB 기준이며 DB 기준일이 없어 시판 전체와 같은지 공시 재확인이 필요하다.",
    "간편결제 지표는 전 연령 수치로 20대 수치는 확인하지 못했다."
  ],
  "clarifications": [],
  "out_of_scope": {
    "detected": false,
    "suggested_agent": null
  },
  "followups": [
    "1순위 셀(GenZ×구독·디지털)로 컨셉 3안을 만들어줘",
    "GenZ×단순함 셀에서 실적조건 완화 구조를 더 자세히 알려줘",
    "19~24세와 25~29세를 나눠 검증하려면 무엇을 확인해야 해?"
  ],
  "input_refs": [
    "05-whitespace/in.json",
    "_code/cells_top.json"
  ]
}