{
  "run_id": "a2",
  "request_id": "a2-guardrail-r1",
  "agent": "guardrail",
  "contract_version": "1.0",
  "model": "claude-sonnet-5-5",
  "status": "ok",
  "answer": "점검 결과 pass 2건(G4, G5), fix 2건(G1, G2 문구), 확인 필요 2건(G3 준법, G6 재무)이다. 체리피커가 채택자의 0.44이고 손익 1.8로 precheck 플래그가 남았으며, 채택 의향 0.375는 목표 0.38에 못 미친다. 채택 의향과 손익은 가상 고객 시뮬레이션 결과이며 법률 판단을 대체하지 않는다.",
  "result": {
    "checks": [
      {
        "id": "G1",
        "item": "이름·한 줄 약속과 실제 작동 방식 일치(과장·불일치)",
        "status": "fix",
        "finding": "이름 '첫 신용카드 실적 졸업 카드(가칭)'의 '졸업'과 hook '6개월 정상 납부를 마치면 실적 조건이 낮아진다'는 mechanics보다 강하게 읽힌다. mechanics는 6개월 연속 정상 납부와 함께 월 실적 20만원 충족을 요구하고, 연체가 생기면 개월 수를 처음부터 다시 세며, 하향은 전월 이용실적 20만원에서 10만원으로의 변경이다. hook에는 월 실적 20만원 충족 조건과 연체 시 재계산이 빠져 있어 정상 납부만 하면 자동으로 졸업하는 것처럼 읽힐 수 있다. 또 이름과 대상 문구는 '첫 신용카드'인데 mechanics의 발급 대상은 '만 19~24세 신규 신용카드 회원'이라서, 이미 다른 신용카드가 있는 신규 발급 고객이 해당하는지 문구만으로 알 수 없다. 한도 상향은 '심사 신청 자격'이 열리는 것이며 심사 결과는 신용평가 기준에 따른다.",
        "suggestion": "hook를 '처음 써 보는 영역에 첫 이용 보상이 붙고, 6개월 연속 정상 납부와 월 실적 20만원 충족을 마치면 전월 이용실적 조건이 10만원으로 낮아진다(연체 시 개월 수 재계산)'로 고친다. 이름 옆 보조 문구나 대상 설명에 '만 19~24세 신규 신용카드 회원 대상'을 쓰고, '첫 신용카드'를 유지하려면 기존 카드 보유자 해당 여부를 상품팀이 정해 문구에 반영한다. 한도 상향은 '이용한도 상향 심사 신청 자격 제공, 결과는 심사에 따름'으로 쓴다.",
        "owner_dept": "상품"
      },
      {
        "id": "G2",
        "item": "광고 표현 위험(단정·과장·오인 소지, 합산 혜택 오인)",
        "status": "fix",
        "finding": "key_benefit는 외식·배달 1.1%, 구독·디지털 0.8%, 온라인쇼핑 0.2%에 '첫 이용 보상이 더해지고 6개월 뒤 실적 조건이 낮아진다'고 이어 써서, 적립률과 첫 이용 보상 1천P가 모두 상시 혜택으로 겹쳐 받는 것처럼 읽힐 소지가 있다. 실제로는 전월 이용실적 20만원 이상인 달 한정, 영역별 월 한도 5천원이고 첫 이용 보상은 영역당 1회이며 상품권·선불충전 결제와 취소 건은 제외된다. 1.1%와 0.8%를 합산하거나 졸업 혜택까지 더한 표현은 오인 소지가 있다. 또 mechanics의 적립률은 '졸업 전 첫 기간 기준 설계값'이어서 졸업 후 적립률이 같은지 입력에 없고, 이 상태로 혜택이 유지되는 것처럼 쓰면 오인될 수 있다. why_unusual의 '입력 DB 50종 중 0종'은 내부 비교 범위이므로 광고에서 '최초', '유일'로 옮기면 단정 표현이 된다.",
        "suggestion": "1) 1.1%, 0.8%, 0.2%가 나오는 모든 지면에 '전월 이용실적 20만원 이상인 달 한정, 영역별 월 한도 5천원'을 같은 크기 수준으로 병기한다. 2) 첫 이용 보상은 '처음 이용하는 영역당 1회 1천P, 상품권·선불충전 결제와 취소 건 제외'로 쓰고 적립률과 합산한 비율이나 배수 표현은 쓰지 않는다. 3) 졸업 후 적립률 적용 여부를 상품팀이 정해 '적립률은 졸업 전 기간 기준'처럼 구분해 쓴다. 4) 경쟁 카드 비교는 '최초', '유일' 대신 '실적 조건이 단계적으로 낮아지는 구조'로 쓴다. 5) 집행 전 카피는 광고심의 검토를 거친다.",
        "owner_dept": "광고심의"
      },
      {
        "id": "G3",
        "item": "부가서비스 변경 제한·혜택 지급 조건 고지",
        "status": "needs_human",
        "finding": "조건 고지의 뼈대는 있다. mechanics에 연회비 0.5만원, 전월 이용실적 20만원, 영역별 월 한도 5천원, 영역당 1회 첫 이용 보상, 졸업 카드당 1회, 챌린지 진행 현황과 졸업 일정의 매월 앱 고지, 혜택 변경 사전 고지, 만 25세 도달 시 조건 종료 시점 사전 고지가 적혀 있다. 확인이 필요한 부분은 입력에 없는 것들이다. (a) 혜택 변경의 사전 고지 기간과 방식, 변경 주기 (b) 졸업 후 전월 이용실적 10만원 조건에서 적립률과 영역별 월 한도가 어떻게 되는지 (c) 만 25세 도달 시 적립률과 졸업 구조가 어떻게 바뀌는지 (d) 졸업 하향과 한도 상향 심사 자격 부여가 부가서비스 변경 제한 범위에 해당하는지. 가입 전 고지 지면에 어떤 항목을 넣을지는 준법 확인이 필요하다. 준법 담당 확인 질문: 졸업 후 조건과 만 25세 도달 후 조건을 가입 전 상품 안내에 어떤 형식으로 고지해야 하며, 혜택 축소로 읽힐 수 있는 변경은 어느 범위까지 사전 고지 대상인가?",
        "suggestion": "상품팀이 (b), (c)의 설계값을 정해 mechanics에 쓴 뒤 준법에 넘긴다. 가입 전 안내문에 전월 이용실적, 월 한도, 첫 이용 보상 제외 거래, 졸업 조건, 만 25세 도달 시 변경을 한 지면에 모아 쓴다.",
        "owner_dept": "준법"
      },
      {
        "id": "G4",
        "item": "그룹사(증권·보험·은행) 연계 시 개인정보 결합·제3자 제공 동의",
        "status": "pass",
        "finding": "links가 비어 있고 mechanics에도 그룹사 연계가 없어 결합이나 제3자 제공 구조를 찾지 못했다. 한도 상향 심사는 자사 신용평가 기준에 따른다고만 적혀 있어 그룹사 정보 이용은 입력에 없다. 이후 설계에서 그룹사 연계나 외부 신용정보 활용이 추가되면 다시 점검해야 한다."
      },
      {
        "id": "G5",
        "item": "투자 연계 상품의 투자권유·원금 손실 오인",
        "status": "pass",
        "finding": "H1에서 투자 연계가 제외됐고 links가 비어 있으며 tags에도 투자 항목이 없다. 보상은 포인트 적립이라 원금 손실이나 종목 선택에 관여하는 구조를 찾지 못했다. precheck_flags에도 G5 항목이 없다."
      },
      {
        "id": "G6",
        "item": "체리피킹·역선택 대비(채택 고객 유형별 손익 참고)",
        "status": "needs_human",
        "finding": "precheck 플래그가 남아 있다. 체리피커(혜택 사냥꾼)가 채택자의 0.44이고 유형별 손익은 1.8이며, 휴면 위험형은 0.16에 손익 1.39로 일반형 3.33, 충성형 5.63보다 낮다. 전체 손익은 3.1이지만 채택 고객 기준 손익은 2.43이다. 방어 장치로 첫 이용 보상 영역당 1회, 졸업 카드당 1회, 영역별 월 적립 한도 5천원, 상품권·선불충전과 취소 건 제외가 mechanics에 있다. 이 장치들이 체리피커 비중 0.44를 낮추는지는 시뮬레이션 모형으로 확인되지 않아 pass로 두지 않는다. 첫 이용 보상을 노린 영역별 1회성 사용 후 휴면, 6개월 납부 요건만 채우는 이용의 연체 위험은 내부 데이터 확인이 필요하다. 재무 담당 확인 질문: 체리피커 손익 1.8과 휴면 위험형 손익 1.39를 지금의 첫 이용 보상 1천P와 월 한도 5천원 설계로 감수할 수 있는가, 아니면 보상 규모나 조건을 조정해 다시 시뮬레이션해야 하는가?",
        "suggestion": "설계값을 바꿀 경우 재무가 첫 이용 보상 1천P와 영역별 월 한도 5천원의 조정안을 정하고 시뮬레이션을 다시 돌린다. 유지하는 경우 기획서 리스크에 체리피커 0.44, 손익 1.8, 휴면 위험형 손익 1.39를 그대로 적는다.",
        "owner_dept": "재무"
      }
    ],
    "name_mechanism_consistent": false,
    "overall": "고칠 것은 G1(hook의 졸업 조건 누락, '첫 신용카드'와 '신규 신용카드 회원' 대상 표현 불일치)과 G2(적립률과 첫 이용 보상이 겹쳐 보이는 표현, 졸업 후 적립률 미기재)이고, 확인받을 것은 G3(준법, 졸업 후와 만 25세 도달 후 조건 고지)와 G6(재무, 체리피커 0.44에 손익 1.8)이다. G4와 G5는 그룹사 연계와 투자 연계가 없어 문제를 찾지 못했다. G1, G2 문구 수정과 G3, G6 담당 확인을 마친 뒤 진행할 수 있다. 채택 의향 0.375는 목표 0.38에 못 미치는 가상 고객 시뮬레이션 결과이며 실제 전환율이 아니다.",
    "required_disclosures": [
      "채택 의향과 손익은 가상 고객 시뮬레이션 결과이며 실제 전환율이나 실제 손익이 아닙니다.",
      "적립은 전월 이용실적 20만원 이상인 달에만 제공되며 영역별 월 한도는 5천원입니다.",
      "첫 이용 보상은 처음 이용하는 영역당 1회 1천P이며 상품권·선불충전 결제와 취소 건은 대상에서 제외됩니다.",
      "실적 조건 완화(졸업)는 발급 후 6개월 연속 정상 납부와 월 실적 20만원 충족 후 적용되며 연체가 생기면 개월 수를 처음부터 다시 셉니다.",
      "이용한도 상향은 심사 신청 자격이 주어지는 것이며 심사 결과와 상향 폭은 신용평가 기준에 따릅니다.",
      "혜택은 변경될 수 있으며 변경 시 사전 고지하고, 만 19~24세 한정 조건이 끝나는 시점도 사전 고지합니다.",
      "연회비는 0.5만원입니다."
    ]
  },
  "findings": [
    {
      "id": "guardrail#0",
      "claim": "G1 fix: hook에 월 실적 20만원 충족과 연체 시 재계산이 빠져 졸업이 납부만으로 이뤄지는 것처럼 읽히고, '첫 신용카드'와 '신규 신용카드 회원' 대상 표현이 어긋난다.",
      "type": "estimate",
      "source_id": null,
      "confidence": "medium"
    },
    {
      "id": "guardrail#1",
      "claim": "G2 fix: 적립률 1.1%, 0.8%, 0.2%와 첫 이용 보상 1천P가 겹쳐 받는 혜택처럼 읽힐 소지가 있고 졸업 후 적립률이 입력에 없다.",
      "type": "estimate",
      "source_id": null,
      "confidence": "medium"
    },
    {
      "id": "guardrail#2",
      "claim": "G3 needs_human(준법): 졸업 후와 만 25세 도달 후 조건, 변경 사전 고지 방식은 입력에 없어 준법 확인이 필요하다.",
      "type": "estimate",
      "source_id": null,
      "confidence": "medium"
    },
    {
      "id": "guardrail#3",
      "claim": "G4 pass: links가 비어 그룹사 연계가 없다.",
      "type": "estimate",
      "source_id": null,
      "confidence": "high"
    },
    {
      "id": "guardrail#4",
      "claim": "G5 pass: 투자 연계가 제외되었고 투자 관련 설계가 없다.",
      "type": "estimate",
      "source_id": null,
      "confidence": "high"
    },
    {
      "id": "guardrail#5",
      "claim": "G6 needs_human(재무): 체리피커 0.44, 손익 1.8, 휴면 위험형 0.16, 손익 1.39로 precheck 플래그가 남아 재무 판단이 필요하다.",
      "type": "estimate",
      "source_id": null,
      "confidence": "medium"
    },
    {
      "id": "guardrail#6",
      "claim": "채택 의향 0.375는 목표 0.38에 미달하며 시뮬레이션 결과이고 실제 전환율이 아니다.",
      "type": "estimate",
      "source_id": null,
      "confidence": "high"
    }
  ],
  "sources": [],
  "assumptions": [
    "수치는 입력의 card, metrics, twin 값만 인용했다.",
    "이 카드는 컨셉 후보 중 선정안이 아닌 후보를 사람이 골라 진행하는 경로의 카드이며, 평가 기준 미달은 숨기지 않고 적었다.",
    "광고 심의 기준 원문이 없어 자체 점검 목록으로 보았다."
  ],
  "unresolved": [
    "졸업 후 적립률과 영역별 월 한도, 만 25세 도달 후 조건은 입력에 없어 상품팀 확인이 필요하다.",
    "'첫 신용카드'와 기존 카드 보유 신규 발급 고객의 해당 여부는 상품팀 확인이 필요하다.",
    "첫 신용카드 고객 연체 위험과 한도 운영 기준은 내부 데이터 확인 필요.",
    "방어 장치가 체리피커 비중을 낮추는 효과는 현재 시뮬레이션으로 확인되지 않았다."
  ],
  "limits": [
    "법률 판단을 대체하지 않으며 needs_human 항목은 담당 부서 확인이 필요하다.",
    "채택 의향과 유형별 손익은 가상 고객 시뮬레이션 결과이며 실제 전환율이 아니다.",
    "채택 의향 0.375는 목표 0.38에 못 미치고 혜택 20% 축소 시나리오는 0.265이다.",
    "광고 심의 기준 원문이 없다."
  ],
  "clarifications": [],
  "out_of_scope": {
    "detected": false,
    "suggested_agent": null
  },
  "followups": [
    "G1, G2 수정안을 반영해 hook와 one_liner를 다시 써줘",
    "G6 남은 위험을 기획서 리스크 항목으로 정리해줘",
    "준법과 재무에 넘길 확인 질문 목록으로 정리해줘"
  ],
  "input_refs": [
    "08-guardrail/in.json"
  ]
}